Date,Headline
"JUL 9, 2015",Dow Jones Today Looks to Add Triple Digits After Wednesday Trading Glitch
"JUL 9, 2015",Why Alcoa's Management Sees Better Times Ahead
"JUL 9, 2016",Alcoa reports its second-quarter numbers July 11
"JUL 9, 2018",5 Spinoff Stocks That Outperform Their Parents
"JUL 9, 2018",AA Crosses Above Key Moving Average Level
"JUN 1, 2014",Weighing The Week Ahead: More Clarity From The Market Message?
"JUN 1, 2016",Insiders Bullish on Certain Holdings of VLUE
"JUN 1, 2016","Bruker Corporation (BRKR) Ex-Dividend Date Scheduled for June 02, 2016"
"JUN 1, 2017",Acxiom to Provide Marketing Solutions to Michaels Stores
"JUN 1, 2021",Some Japan buyers agree to pay 24-25% higher Q3 aluminium premium of $185/T
"JUN 1, 2022",Alcoa (AA) Gains As Market Dips: What You Should Know
"JUN 10, 2014",A Look At Index Weighting
"JUN 10, 2016",Can Section 72(t) Help You Get Early IRA Access?
"JUN 10, 2021",July 30th Options Now Available For Alcoa (AA)
"JUN 10, 2021","Pre-Market Most Active for Jun 10, 2021 : CLOV, WISH, IVR, CLNE, AMC, MDLY, AHT, CLF, XIN, FCEL, SQQQ, AAL"
"JUN 10, 2022",Validea Peter Lynch Strategy Daily Upgrade Report - 6/10/2022
"JUN 11, 2014","Analogic Corporation (ALOG) Ex-Dividend Date Scheduled for June 12, 2014"
"JUN 11, 2014","Jinpan International Limited (JST) Ex-Dividend Date Scheduled for June 12, 2014"
"JUN 11, 2015","After Hours Most Active for Jun 11, 2015 : QRVO, TWTR, WETF, QCOM, LO, GM, FOXA, GILD, AA, RAI, QQQ, AMH"
"JUN 11, 2020","Why Metals Stocks Alcoa, U.S. Steel, and Freeport-McMoRan All Crashed Today"
"JUN 11, 2020",July 31st Options Now Available For Alcoa (AA)
"JUN 11, 2022",Validea Kenneth Fisher Strategy Daily Upgrade Report - 6/11/2022
"JUN 12, 2013",Buyers coming back to Agilent Tech
"JUN 12, 2015",Q2 Earnings Season Gets Going - Earnings Preview
"JUN 12, 2018",Interesting A Put And Call Options For September 21st
"JUN 12, 2019",Alcoa (AA) Shares Enter Oversold Territory
"JUN 12, 2020",Validea Peter Lynch Strategy Daily Upgrade Report - 6/12/2020
"JUN 13, 2013","Jinpan International Limited (JST) Ex-Dividend Date Scheduled for June 14, 2013"
"JUN 13, 2017","Fujifilm (FUJIY) Beats on Earnings, Misses Revenues in Q4"
"JUN 13, 2018","Notable Wednesday Option Activity: KO, AA, BLUE"
"JUN 13, 2019",August 2nd Options Now Available For Alcoa (AA)
"JUN 13, 2022",Investors Heavily Search Alcoa (AA): Here is What You Need to Know
"JUN 13, 2022",Here's Why Agilent Technologies (A) is a Strong Growth Stock
"JUN 13, 2022",Should SPDR Portfolio S&P 400 Mid Cap ETF (SPMD) Be on Your Investing Radar?
"JUN 13, 2022",New to Investing? This 1 Computer and Technology Stock Could Be the Perfect Starting Point
"JUN 13, 2023",Global aluminium producer cuts Q3 premium offer to $170/T from initial $180/T -sources
"JUN 13, 2023","Noteworthy Tuesday Option Activity: GNRC, AA, LUV"
"JUN 13, 2023","Noteworthy Tuesday Option Activity: GNRC, AA, LUV"
"JUN 13, 2023",Global aluminium producer cuts Q3 premium offer to $170/T from initial $180/T -sources
"JUN 14, 2010",Richard Karn: A Bridge Too Far. . .to the Left?
"JUN 14, 2016","Notable Tuesday Option Activity: DECK, AA, ALLY"
"JUN 14, 2016",Notable Two Hundred Day Moving Average Cross - AA
"JUN 14, 2016","John Wiley & Sons Q4 EPS Meets, Sales Narrowly Top Views; Sees Flat Revenues and Lower EPS in FY17"
"JUN 14, 2018",Agilent (A) Gets FDA Approval for Cervical Cancer Test Assay
"JUN 14, 2020","Why Metals Stocks Alcoa, U.S. Steel, and ArcelorMittal Popped Friday"
"JUN 14, 2023",Alcoa (AA) Stock Sinks As Market Gains: What You Should Know
"JUN 14, 2023",Alcoa (AA) Stock Sinks As Market Gains: What You Should Know
"JUN 15, 2012",Agilent Launches New Design - Analyst Blog
"JUN 15, 2020",GRAPHIC-Canadian exemption from U.S. aluminium import levy under scrutiny
"JUN 15, 2021","Noteworthy Tuesday Option Activity: SWBI, AA, HIG"
"JUN 15, 2022",Alcoa Investing $51 Mln At Its Mosjøen Smelter In Norway
"JUN 15, 2022",7 Undervalued Stocks That the Smart Money Is Piling Into
"JUN 15, 2023",We Did The Math MDY Can Go To $534
"JUN 15, 2023",Validea's Top 5 Materials Stocks Based On Warren Buffett - 6/15/2023
"JUN 15, 2023",We Did The Math MDY Can Go To $534
"JUN 15, 2023",Validea's Top 5 Materials Stocks Based On Warren Buffett - 6/15/2023
"JUN 16, 2017",Fujifilm (FUJIY) Braves Currency Headwinds on Growth Drivers
"JUN 16, 2020",5 Great Stocks for Beginners to Buy Now
"JUN 17, 2014","Cohu, Inc. (COHU) Ex-Dividend Date Scheduled for June 18, 2014"
"JUN 17, 2016","Itron, WaterSmart Tie Up to Boost Water Efficiency in Utilities"
"JUN 17, 2017",2017 Investor's Guide to the Top 10 Military Aircraft -- That Aren't Fighter Jets
"JUN 17, 2021",Alcoa details plans to cut carbon emissions from making alumina
"JUN 17, 2022",First Week of February 2023 Options Trading For Agilent Technologies (A)
"JUN 17, 2022",Analysts Expect AIVL To Hit $111
"JUN 18, 2013","Cohu, Inc. (COHU) Ex-Dividend Date Scheduled for June 19, 2013"
"JUN 18, 2014",Alcoa Expanding Virginia Plant to Make Jet Engine Blades - Analyst Blog
"JUN 18, 2016",3 Great Stocks Under $10
"JUN 18, 2021",Alcoa (AA) Shares Enter Oversold Territory
"JUN 18, 2021",Why AMC Stock Popped But Express and Alcoa Stocks Dropped This Week
"JUN 19, 2014",Praxair Starts Oxygen Supply Plant in Uruguay - Analyst Blog
"JUN 19, 2015",3 Things to Know About Q2 Earnings Season - Earnings Trends
"JUN 19, 2015",3 Things to Know About Q2 Earnings Season - Earnings Outlook
"JUN 19, 2017",Agilent (A) Expands Use of Cancer Diagnostics in Europe
"JUN 19, 2020",First Week of September 18th Options Trading For Alcoa (AA)
"JUN 19, 2020",COLUMN-Friend or foe? Canadian imports split U.S. aluminium sector: Andy Home
"JUN 2, 2014","One Put, One Call Option To Know About for Alcoa"
"JUN 2, 2015",TIAA-CREF: What This $8.6 Billion Trust Has Been Selling
"JUN 2, 2015","After Hours Most Active for Jun 2, 2015 : BBEP, QCOM, ACHN, OZM, NVAX, INFI, PDLI, TSM, HD, AA, GE, WRI"
"JUN 2, 2018",Alcoa's Environmental Breakthrough Could Change the Face of the Company
"JUN 2, 2023",Validea Detailed Fundamental Analysis - AA
"JUN 2, 2023","Noteworthy Friday Option Activity: IRBT, DDD, AA"
"JUN 2, 2023","Noteworthy Friday Option Activity: IRBT, DDD, AA"
"JUN 2, 2023",Validea Detailed Fundamental Analysis - AA
"JUN 20, 2013",Agilent Prices Senior Notes - Analyst Blog
"JUN 20, 2013","Kimball International, Inc. (KBALB) Ex-Dividend Date Scheduled for June 21, 2013"
"JUN 20, 2014","Kimball International, Inc. (KBALB) Ex-Dividend Date Scheduled for June 23, 2014"
"JUN 20, 2014","Buzz on the Street: What Traders Are Saying About Gold, the S&P 500, and the Federal Reserve"
"JUN 20, 2016","One Put, One Call Option To Know About for Alcoa"
"JUN 20, 2022",Alcoa (AA) Stock Sinks As Market Gains: What You Should Know
"JUN 21, 2017",Better Buy: Freeport-McMoRan Inc. vs. Alcoa
"JUN 21, 2020",COLUMN-Friend or foe? Canadian imports split U.S. aluminium sector: Andy Home
"JUN 21, 2021",We Did The Math IYM Can Go To $142
"JUN 22, 2015",Interesting September Stock Options for Alcoa
"JUN 22, 2015","After Hours Most Active for Jun 22, 2015 : QCOM, QQQ, ADBE, BAC, GM, AAPL, ABBV, FTR, ORAN, AA, GEVA, IBN"
"JUN 22, 2015","Zacks Earnings Trends Highlights: Alcoa, FedEx and Oracle - Press Releases"
"JUN 22, 2016",Itron Smart Water Solution to Improve PWC's Water Delivery
"JUN 22, 2017","Berkshire Hathaway to Make CAD400 Mln Investment in Home Capital, Provide New CAD2 Bln Credit Facility"
"JUN 22, 2017","An 8-Factor HJM Model For The Japanese Government Bond Yield Curve, 1974 To 2016: The Impact Of Negative Rates And Smoothing Issues"
"JUN 22, 2018",General Electric (GE) May Be Close to Rock Bottom
"JUN 22, 2021",Fed Chair's Testimony to Support Inflation Trades: Here's One Stock to Consider
"JUN 22, 2022",Should iShares MSCI USA SmallCap Multifactor ETF (SMLF) Be on Your Investing Radar?
"JUN 22, 2023",Interesting AA Put And Call Options For August 4th
"JUN 22, 2023",Interesting AA Put And Call Options For August 4th
"JUN 22, 2023",Interesting AA Put And Call Options For August 4th
"JUN 22, 2023",Interesting AA Put And Call Options For August 4th
"JUN 23, 2016","After Hours Most Active for Jun 23, 2016 : FBHS, BAC, TVIX, AA, FCX, MSFT, DOW, HPE, XIV, WFM, LXRX, AAPL"
"JUN 23, 2016",5 Basic Materials Stocks to Buy on Strong Momentum
"JUN 23, 2017",Why Agilent Technologies (A) Stock Might be a Great Pick
"JUN 23, 2021",Why Falling Homebuilder Stocks Look Like a Buy
"JUN 23, 2022",Agilent (A) Down 5.5% Since Last Earnings Report: Can It Rebound?
"JUN 23, 2023",Alcoa (AA) Dips More Than Broader Markets: What You Should Know
"JUN 23, 2023",Alcoa (AA) Dips More Than Broader Markets: What You Should Know
"JUN 24, 2014","CTS Corporation (CTS) Ex-Dividend Date Scheduled for June 25, 2014"
"JUN 24, 2014",Alcoa Hits a New 52-Week High - Analyst Blog
"JUN 24, 2015",Handicapping the Q2 Earnings Season - Earnings Trends
"JUN 24, 2015",Handicapping the Q2 Earnings Season - Earnings Outlook
"JUN 24, 2016",Brexit Results Shock the Market
"JUN 24, 2016",A Prescription For Teva Shareholders On Actavis Generics
"JUN 24, 2016",Q2 Earnings Season Gets Underway
"JUN 24, 2020",COLUMN-COVID-19 will tilt aluminium axis further towards China: Andy Home
"JUN 24, 2020",Why Alcoa Stock Dropped 9% Today
"JUN 24, 2020",COLUMN-COVID-19 will tilt aluminium axis further towards China: Andy Home
"JUN 24, 2021","Is Agilent Technologies, Inc. (NYSE:A) Potentially Undervalued?"
"JUN 24, 2022","XME, ARCH, RGLD, AA: Large Outflows Detected at ETF"
"JUN 24, 2022",Alcoa (AA) Is a Trending Stock: Facts to Know Before Betting on It
"JUN 25, 2012",Agilent Closes Dako Buyout - Analyst Blog
"JUN 25, 2013","Molex Incorporated (MOLX) Ex-Dividend Date Scheduled for June 26, 2013"
"JUN 25, 2013","Molex Incorporated (MOLXA) Ex-Dividend Date Scheduled for June 26, 2013"
"JUN 25, 2013","CTS Corporation (CTS) Ex-Dividend Date Scheduled for June 26, 2013"
"JUN 25, 2014","RF Industries, Ltd. (RFIL) Ex-Dividend Date Scheduled for June 26, 2014"
"JUN 25, 2015","Agilent Technologies, Inc. (A) Ex-Dividend Date Scheduled for June 26, 2015"
"JUN 25, 2019",First Week of September 20th Options Trading For Alcoa (AA)
"JUN 25, 2020","Ex-Dividend Reminder: National Fuel Gas, Algonquin Power & Utilities and Agilent Technologies"
"JUN 25, 2020",Validea Peter Lynch Strategy Daily Upgrade Report - 6/25/2020
"JUN 26, 2014","US Futures Near Unchanged as Weekly Jobless Claims Edge Lower, Income Increases as Expected"
"JUN 26, 2014",Why The Bed Bath and Beyond (BBBY) Results May Be An Indicator Of A Weak Earnings Season
"JUN 26, 2014","In the news: Barclays gets sued, Phillip Morris cuts estimates and more"
"JUN 26, 2014","Pre-Market Most Active for Jun 26, 2014 : AA, BCS, BRX, FB, VOD, AUXL, TWTR, IRM, BBBY, LEN, AAPL, QQQ"
"JUN 26, 2014","US Futures Near Unchanged Amid Jobless, Income and Spending Data"
"JUN 26, 2014","Agilent Technologies, Inc. (A) Ex-Dividend Date Scheduled for June 27, 2014"
"JUN 26, 2017",Here's Why Arconic Fell As Much As 11.3% This Morning
"JUN 26, 2017","Arconic Reportedly Supplied Flammable Panels to Grenfell Tower, Shares Slide"
"JUN 26, 2022","With Aluminum Prices On The Decline, What Next For Alcoa?"
"JUN 27, 2013","Agilent Technologies, Inc. (A) Ex-Dividend Date Scheduled for June 28, 2013"
"JUN 27, 2013",Agilent Software Adopted by Millitech - Analyst Blog
"JUN 27, 2014",Alcoa Takes Flight on $2.85 Billion Firth Rixson Buyout - Analyst Blog
"JUN 27, 2014","Company News for June 27, 2014 - Corporate Summary"
"JUN 27, 2016","Monday's Vital Data: Apple Inc. (AAPL), Bank of America Corp (BAC) and Alcoa Inc. (AA)"
"JUN 27, 2016",1 Unexpected Company Poised to Dominate 3D Printing
"JUN 27, 2016","FedEx, Oracle, Adobe and Alcoa are part of Zacks Earnings Preview:"
"JUN 27, 2017","Noteworthy Tuesday Option Activity: SGMS, AA, AXDX"
"JUN 27, 2018",5 Perfect Stocks to Buy On the Dip
"JUN 27, 2019","Ex-Dividend Reminder: Choice Hotels International, Agilent Technologies and Mack Cali Realty"
"JUN 28, 2012",Agilent's Fastest USB Power Sensor - Analyst Blog
"JUN 28, 2012",PolyOne Expands in South Africa - Analyst Blog
"JUN 28, 2016",Agilent (A) Inks Deal to Take OverAssets ofiLab Solutions
"JUN 28, 2017",Unisys ClearPath Software Selected by Malaysia's ANGKASA
"JUN 28, 2017","Agilent Technologies, Inc. (A) Ex-Dividend Date Scheduled for June 29, 2017"
"JUN 28, 2018","Ex-Dividend Reminder: Comcast, Agilent Technologies and Cousins Properties"
"JUN 28, 2018","Agilent (A) Opens Logistics Center, Expands China Foothold"
"JUN 29, 2012",Waters Corp. Reiterated at Neutral - Analyst Blog
"JUN 29, 2016","Agilent Technologies, Inc. (A) Ex-Dividend Date Scheduled for June 30, 2016"
"JUN 29, 2016",Itron Inks Deal with PT PLN to Deploy Smart Payment Meters
"JUN 29, 2016",3 Small-Cap Stocks to Buy Before Brexit Fears Subside
"JUN 29, 2016","Why Alcoa Inc (AA), Esperion Therapeutics Inc (ESPR) and Southwestern Energy Company (SWN) Are 3 of Today's Worst Stocks"
"JUN 29, 2016","Wednesday's Vital Data: Bank of America Corp. (BAC), Apple Inc. (AAPL) and Nike Inc (NKE)"
"JUN 29, 2017",The Top Dividend Stock in Aluminum
"JUN 29, 2017",Bank of America Plans to Boost Quarterly Dividend 60% Following Fed OK; Berkshire to Consider Stock Swap
"JUN 29, 2018","Agilent (A) to Acquire ProZyme, Expand Glycan Market Share"
"JUN 29, 2018","Agilent Technologies, Inc. (A) Ex-Dividend Date Scheduled for July 02, 2018"
"JUN 29, 2022","Some Japanese buyers agree to Q3 aluminium premium of $148/T, down 14% from Q2"
"JUN 29, 2022","Ex-Dividend Reminder: Agilent Technologies, Brixmor Property Group and Hannon Armstrong Sustainable Infrastructure Capital"
"JUN 3, 2013",Agilent and UC-Berkeley Team Up - Analyst Blog
"JUN 3, 2014",Dako and Merck Collaborate - Analyst Blog
"JUN 3, 2014","AVX Corporation (AVX) Ex-Dividend Date Scheduled for June 04, 2014"
"JUN 3, 2015",Alcoa (AA) Invests $22 Million in Aerospace Technology - Analyst Blog
"JUN 3, 2016",5 Drowsy Stocks That Won't Wake Up Soon
"JUN 30, 2014",Stock Pick Of The Week: Alcoa Inc (AA)
"JUN 30, 2014","Park Electrochemical Corporation (PKE) Ex-Dividend Date Scheduled for July 01, 2014"
"JUN 30, 2014",Earnings Expectations For The Week Of June 30: Season Draws To A Close
"JUN 30, 2014","XLF, JKG: Big ETF Outflows"
"JUN 30, 2015",Alcoa's Preferred Stock Crosses Above 4.5% Yield Territory
"JUN 30, 2016",Alcoa Files Form 10 with SEC for Planned Business Split
"JUN 30, 2016",Here's How Alcoa Plans To Apportion Its Debt Among Its Successor Companies Post The Upcoming Split
"JUN 30, 2016",Badger Meter (BMI) Looks Good on Sales Channels Expansion
"JUN 30, 2021",3 Industrial Stocks To Watch In July 2021
"JUN 30, 2021","Ex-Dividend Reminder: Edison International, Agilent Technologies and Cousins Properties"
"JUN 30, 2022",AA August 12th Options Begin Trading
"JUN 30, 2023",Alcoa (AA) Gains But Lags Market: What You Should Know
"JUN 30, 2023",Alcoa (AA) Gains But Lags Market: What You Should Know
"JUN 4, 2015",Looking Ahead to the Q2 Earnings Season - Earnings Outlook
"JUN 4, 2018","Agilent Completes AATI Acquisition, Strengthens Portfolio"
"JUN 4, 2018",The Effects of Steel and Aluminum Tariffs Hinge on Trump's Negotiation Skills
"JUN 4, 2019",S&P 500 Analyst Moves: A
"JUN 4, 2021","XME, HL, STLD, AA: ETF Inflow Alert"
"JUN 5, 2013",Kraton to Feature NEXAR Polymer Coatings in Germany - Analyst Blog
"JUN 5, 2013",PolyOne Closes Resin Assets Sale - Analyst Blog
"JUN 5, 2014",Sector Update: Tech Technology
"JUN 5, 2015","Zacks Earnings Trends Highlights: Adobe, Nike, FedEx and Alcoa - Press Releases"
"JUN 5, 2015",Alcoa Power Plate Aluminum in Samsung Galaxy S6 Phones - Analyst Blog
"JUN 5, 2017","One Put, One Call Option To Know About for Alcoa Corporation"
"JUN 5, 2019",Here's Why Agilent Technologies Fell 14.6% in May
"JUN 5, 2020",Alcoa Reaches Analyst Target Price
"JUN 5, 2020","Why Industrial Stocks Harley-Davidson, Middleby, and Alcoa Surged This Morning"
"JUN 6, 2014","Amphenol Corporation (APH) Ex-Dividend Date Scheduled for June 09, 2014"
"JUN 6, 2016",Alcoa $3.75 Preferred Stock About To Put More Money In Your Pocket
"JUN 6, 2016",Interesting August Stock Options for AA
"JUN 6, 2019",AA July 26th Options Begin Trading
"JUN 6, 2021","The Executive VP & General Counsel of Alcoa Corporation (NYSE:AA), Jeffrey Heeter, Just Sold 87% Of Their Holding"
"JUN 7, 2011",Guggenheim To Change Index On SEA
"JUN 7, 2013","Amphenol Corporation (APH) Ex-Dividend Date Scheduled for June 10, 2013"
"JUN 7, 2016",Itron (ITRI) Scales New 52-Week High on Healthy Prospects
"JUN 7, 2017",Brown-Forman Fiscal Q4 EPS Meets Views; Revenue Beats; Guides Mid-Single Digit Net Sales Growth in 2018
"JUN 7, 2020",Why Shares of Alcoa Gained 13% in May
"JUN 8, 2012",Agilent Launches Bluetooth Test - Analyst Blog
"JUN 8, 2015",Cash Dividend On The Way From Alcoa Preferred Stock
"JUN 8, 2015",Interesting July Stock Options for Alcoa
"JUN 8, 2016",Why Alcoa Inc.'s Shares Fell 15% in May
"JUN 8, 2017",Unisys Launches FamilyNow for Aiding Social Service Agencies
"JUN 8, 2017",3 Stocks With Mobileye-Like Return Potential
"JUN 8, 2018",Renaissance IPO Index - Notice of June 2018 Quarterly Changes
"JUN 8, 2022",Agilent (A) to Provide Genomics Innovation Via New Tie-Ups
"JUN 8, 2023",Interesting AA Put And Call Options For July 28th
"JUN 8, 2023",Interesting AA Put And Call Options For July 28th
"JUN 9, 2014","Vishay Intertechnology, Inc. (VSH) Ex-Dividend Date Scheduled for June 10, 2014"
"JUN 9, 2014",3 Hot Chemical/Plastic Plays! - Analyst Blog
"JUN 9, 2014",Alcoa Continues Strategic Shift Towards Value-Added Products With New Aerospace Facility
"JUN 9, 2016","Commit To Buy Alcoa At $7, Earn 11.3% Using Options"
"JUN 9, 2017",YieldBoost Alcoa Corporation To 5.5% Using Options
"JUN 9, 2022","Thursday's ETF Movers: GXC, PICK"
"JUN 9, 2022",Alcoa Breaks Below 200-Day Moving Average - Notable for AA
"JUN 9, 2022",Alcoa To Participate In Deutsche Bank Materials Conference At 9:45 AM ET
"MAR 1, 2012",Waters Reiterates at Neutral - Analyst Blog
"MAR 1, 2013",Are You a Bull or Bear? - Real Time Insight
"MAR 1, 2016","Bruker Corporation (BRKR) Ex-Dividend Date Scheduled for March 02, 2016"
"MAR 1, 2016",Bullish Two Hundred Day Moving Average Cross - A
"MAR 1, 2017",Aluminum Stocks Surge on Reports of a Chinese Output Cut
"MAR 1, 2019","Bruker Corporation (BRKR) Ex-Dividend Date Scheduled for March 04, 2019"
"MAR 1, 2020",Validea's Top Five Technology Stocks Based On Peter Lynch - 3/1/2020
"MAR 1, 2022",Why Alcoa Stock Jumped as Much as 13.5% Today
"MAR 1, 2022",Interesting AA Put And Call Options For October 21st
"MAR 10, 2014",PowerTrend Brief: Listening to 'Uncle' Warren Buffett Pays off Handsomely
"MAR 10, 2015",Alcoa (AA) Falls: Stock Goes Down 5.4% - Tale of the Tape
"MAR 10, 2015",Alcoa Bolsters Aerospace Portfolio with $1.5B RTI Buy - Analyst Blog
"MAR 10, 2015","After Hours Most Active for Mar 10, 2015 : AAPL, QQQ, AVP, F, BAC, AA, ITUB, ABBV, CSCO, MSFT, ROSE, FB"
"MAR 10, 2015","Stock Market News for March 10, 2015 - Market News"
"MAR 10, 2015",The Simple 3-Question Financial Quiz Most Americans Fail: Can You Pass It?
"MAR 10, 2021",Brazil's Vale approves list of board candidates
"MAR 10, 2023",New Strong Sell Stocks for March 10th
"MAR 10, 2023",New Strong Sell Stocks for March 10th
"MAR 10, 2023",New Strong Sell Stocks for March 10th
"MAR 10, 2023",New Strong Sell Stocks for March 10th
"MAR 11, 2013",What to Know from March's Strategy Report - Analyst Blog
"MAR 11, 2013",Itron to Repurchase Share - Analyst Blog
"MAR 11, 2013",Buffett Banks on Natural Gas Trains
"MAR 11, 2014",Plug Power: Is This Time Different?
"MAR 11, 2016","Stock Market News for March 11, 2016"
"MAR 11, 2021",Interesting AA Put And Call Options For April 30th
"MAR 11, 2022","Is Alcoa (AA) a Solid Growth Stock? 3 Reasons to Think "" Yes """
"MAR 11, 2022",Best Momentum Stocks to Buy for March 11th
"MAR 11, 2022",New to Investing? This 1 Computer and Technology Stock Could Be the Perfect Starting Point
"MAR 11, 2022",New Strong Buy Stocks for March 11th
"MAR 13, 2014","Behind The Scenes With Dream Team, CytRx And Galena"
"MAR 13, 2014","Analogic Corporation (ALOG) Ex-Dividend Date Scheduled for March 14, 2014"
"MAR 13, 2015",Don't Dump Dow Jones Industrial Average Stocks Just Because the Index Did
"MAR 14, 2013",PolyOne-Spartech Merger OK'd - Analyst Blog
"MAR 14, 2014",How Do You Play the Ukraine? - Real Time Insight
"MAR 14, 2016",14.0% of JKI Holdings Seeing Recent Insider Buys
"MAR 14, 2016",Agilent (A) & Eurofins Team Up for SureVector Expansion
"MAR 14, 2017","XME, AA, NEM, X: Large Outflows Detected at ETF"
"MAR 14, 2022","Noteworthy ETF Inflows: XME, BTU, ARCH, AA"
"MAR 14, 2022",Implied FIW Analyst Target Price: $98
"MAR 14, 2022",AA September 16th Options Begin Trading
"MAR 14, 2023",Alcoa Australia to cut Portland aluminium smelter output to 75% capacity
"MAR 14, 2023",Alcoa's Australia unit to cut output at Portland aluminium smelter
"MAR 14, 2023",New Strong Sell Stocks for March 14th
"MAR 14, 2023",Alcoa Australia to cut Portland aluminium smelter output to 75% capacity
"MAR 14, 2023",Alcoa's Australia unit to cut output at Portland aluminium smelter
"MAR 14, 2023",Alcoa (AA) Stock Sinks As Market Gains: What You Should Know
"MAR 14, 2023",Alcoa Australia to cut Portland aluminium smelter output to 75% capacity
"MAR 14, 2023",Alcoa (AA) Stock Sinks As Market Gains: What You Should Know
"MAR 14, 2023",Alcoa's Australia unit to cut output at Portland aluminium smelter
"MAR 14, 2023",Alcoa (AA) Stock Sinks As Market Gains: What You Should Know
"MAR 14, 2023",New Strong Sell Stocks for March 14th
"MAR 14, 2023",New Strong Sell Stocks for March 14th
"MAR 14, 2023",Alcoa (AA) Stock Sinks As Market Gains: What You Should Know
"MAR 14, 2023",New Strong Sell Stocks for March 14th
"MAR 14, 2023",Alcoa's Australia unit to cut output at Portland aluminium smelter
"MAR 14, 2023",Alcoa Australia to cut Portland aluminium smelter output to 75% capacity
"MAR 15, 2016","Why Alcoa, 3D Systems, and Sanderson Farms Slumped Today"
"MAR 15, 2017","S&P 500 Movers: NSC, A"
"MAR 15, 2017",3 Winning Stocks to Buy That Will Humble Wall Street Analysts
"MAR 15, 2018",How Is Alcoa Likely To Grow In The Next 2 Years?
"MAR 15, 2022",Alcoa (AA) Gains But Lags Market: What You Should Know
"MAR 15, 2022",Are These Industrial Products Stocks a Great Value Stocks Right Now?
"MAR 15, 2023",Shares of AA Now Oversold
"MAR 15, 2023",Shares of AA Now Oversold
"MAR 15, 2023",Shares of AA Now Oversold
"MAR 15, 2023",Shares of AA Now Oversold
"MAR 16, 2015",Q1 Earnings Season Gets Underway - Earnings Preview
"MAR 16, 2015","The Zacks Analyst Blog Highlights: Alcoa, RTI International Metals, Simon Property Group, Macerich and Apple - Press Releases"
"MAR 16, 2017",Agilent Technologies: Koh Boon Hwee Appointed New Chairman
"MAR 16, 2017","Daily Dividend Report: ORCL, DG, WSM, A, SRC, PEGA, LXP"
"MAR 16, 2018",Philips' Dual Use DRF System Gets FDA Nod for Marketing
"MAR 16, 2018",Agilent (A) Down 2.6% Since Earnings Report: Can It Rebound?
"MAR 16, 2023","METALS-London copper rebounds as Credit Suisse gets lifeline, China demand"
"MAR 16, 2023","METALS-London copper rebounds as Credit Suisse gets lifeline, China demand"
"MAR 16, 2023","METALS-London copper rebounds as Credit Suisse gets lifeline, China demand"
"MAR 16, 2023","METALS-London copper rebounds as Credit Suisse gets lifeline, China demand"
"MAR 17, 2015","Alcoa, Oracle and Adobe are part of Zacks Earnings Preview: - Press Releases"
"MAR 17, 2016","Alcoa Inc: AA Stock Is Good for a Trade, But Be Quick!"
"MAR 17, 2016","Daily Dividend Report: INTC, WSM, A, CSC, MRVL"
"MAR 17, 2017",Top Ranked Value Stocks to Buy for March 17th
"MAR 17, 2017",Agilent (A) Up 4.8% Since Earnings Report: Can It Continue?
"MAR 17, 2017",Better Buy: Alcoa Inc. vs. Hecla Mining
"MAR 17, 2021",Wall Street Roundup: Bullish & Bearish Calls Of The Day
"MAR 17, 2022",New Strong Buy Stocks for March 17th
"MAR 17, 2022",Best Momentum Stocks to Buy for March 17th
"MAR 17, 2022",Best Value Stocks to Buy for March 17th
"MAR 18, 2013","Analogic Corporation (ALOG) Ex-Dividend Date Scheduled for March 20, 2013"
"MAR 18, 2013","Synergetics: Unlocking Value, A Tough Textbook Case"
"MAR 18, 2014",Agilent Unveils Advanced Sound Analyzer - Analyst Blog
"MAR 18, 2015",Alcoa (AA) Plans to Curtail Suralco's Refining Capacity - Analyst Blog
"MAR 18, 2019","Noteworthy Monday Option Activity: CMTL, NKE, AA"
"MAR 18, 2021",Alcoa signs electricity deals for Portland aluminium smelter
"MAR 18, 2021","Daily Dividend Report: SBUX,A,MMC,WSM,CUZ,NLY"
"MAR 18, 2021",Should You Hold On To Alcoa Stock After 9% Rally Last Week?
"MAR 18, 2021",Alcoa Australian smelter wins new lifeline to 2026
"MAR 19, 2013",TXN's New Evaluation Kit - Analyst Blog
"MAR 19, 2014",Agilent Launches Z-Series Oscilloscopes - Analyst Blog
"MAR 19, 2015","Daily Dividend Report: RTN, WSM, TMK, INTC, A"
"MAR 19, 2019",Tencent (TCEHY) to Report Q4 Earnings: What's in the Cards?
"MAR 19, 2019",Alcoa Stock Is Building Energy for a Potential Spike
"MAR 19, 2020","Daily Dividend Report: EPD,A,INGR,WSM,VTR"
"MAR 2, 2015",Deluge of genetic tests: RainDance Technologies files for a $60 million IPO
"MAR 2, 2016","Brown-Forman Fiscal Q3 Earnings Meet Views, Revenue Shy; Lowers FY EPS Guidance"
"MAR 2, 2017","The Zacks Analyst Blog Highlights: Alcoa, AK Steel, U.S. Concrete, JPMorgan and Exxon Mobil"
"MAR 2, 2017",Why Alcoa (AA) Could Be a Potential Winner
"MAR 2, 2018",Is Alcoa Inc. a Buy?
"MAR 2, 2018","Bruker Corporation (BRKR) Ex-Dividend Date Scheduled for March 05, 2018"
