Date,Headline
"APR 1, 2014","Daily Dividend Report: TJX, RPM, A, AFG, WSO"
"APR 1, 2014","Park Electrochemical Corporation (PKE) Ex-Dividend Date Scheduled for April 02, 2014"
"APR 1, 2015","After Hours Most Active for Apr 1, 2015 : AA, MU, PFE, ACWI, MYL, JNJ, MRK, AVIV, QQQ, PAGP, THRM, GILD"
"APR 1, 2016","FEI Company (FEIC) Ex-Dividend Date Scheduled for April 04, 2016"
"APR 1, 2016",Friday's ETF with Unusual Volume: FXZ
"APR 1, 2016","Stock Market News for April 01, 2016"
"APR 1, 2018",Better Buy: Freeport-McMoRan Inc. vs. Alcoa Corporation
"APR 1, 2020",Look Under The Hood: HUSV Has 22% Upside
"APR 1, 2021","Alcoa Completes Sale Of Rolling Mill, Associated Assets Near Evansville"
"APR 1, 2021","Agilent Technologies, Inc. (A) Ex-Dividend Date Scheduled for April 05, 2021"
"APR 1, 2021","Ex-Dividend Reminder: Dollar General Corp, Rent-A-Center and Agilent Technologies"
"APR 10, 2013","Company News for April 10, 2013 - Corporate Summary"
"APR 10, 2013",Itron's AMI Solution Fully Utilized - Analyst Blog
"APR 10, 2014",H-P to Pay $108M to DOJ and SEC - Analyst Blog
"APR 10, 2014",Alcoa Earnings Preview: Low Aluminum Prices Will Weigh On Results
"APR 10, 2014","Stock Market News for April 10, 2014 - Market News"
"APR 10, 2014",Is A. Schulman (SHLM) Stock a Great Combo of Value and Growth? - Tale of the Tape
"APR 10, 2014","Bel Fuse Inc. (BELFB) Ex-Dividend Date Scheduled for April 11, 2014"
"APR 10, 2014","Bel Fuse Inc. (BELFA) Ex-Dividend Date Scheduled for April 11, 2014"
"APR 10, 2015","Dow 30 Stock Roundup: Intel Merges Mobile and PC Results, Boeing's Q1 Deliveries Jump - Analyst Blog"
"APR 10, 2017","PerkinElmer, Inc. (PKI) Ex-Dividend Date Scheduled for April 11, 2017"
"APR 10, 2018",Why These Aluminum ETFs & Stocks Jumped on Monday
"APR 10, 2018","Alibaba Partners With E-Glober, Expands Cloud to Turkey"
"APR 10, 2019","5 Top Stock Trades for Thursday: DAL, LYFT, AMD, NKE, CRM"
"APR 10, 2019","5 Top Stock Trades for Thursday: DAL, LYFT, AMD, NKE, CRM"
"APR 11, 2014","#PreMarket Primer: Friday, April 11: Tension Between The West And Russia Escalates With Threats Of Energy Supply Interruptions"
"APR 11, 2016",Close Update: Stocks Trade Lower as Alcoa Starts Earnings Season
"APR 11, 2016","Alcoa, CSX, Fastenal, J.P. Morgan and Delta Airlines are part of Zacks Earnings Preview:"
"APR 11, 2016",Alcoa Holds Bullish History for Shorts Trading Shares off Earnings-Driven After-Hours Moves
"APR 11, 2016","Why Alcoa Inc (AA), American Airlines Group Inc (AAL) and Hatteras Financial Corp. (HTS) Are 3 of Today's Best Stocks"
"APR 11, 2016","Stock Futures Buoyant on Europe, Firm Dollar"
"APR 11, 2016",Materials ETFs Pop As Investors Gird For 'Steep Decline' In Earnings
"APR 11, 2016",ForexLive Asia FX news wrap: OZ business conditions to strongest in 8 years
"APR 11, 2016",Q1 2016 Tracking Ever-Lower
"APR 11, 2016",How The Parts Add Up: RPV Targets $57
"APR 11, 2016","Monday's Vital Data: Apple Inc. (AAPL), Facebook Inc (FB) and Tesla Motors Inc (TSLA)"
"APR 11, 2016","3 Stocks to Watch for Earnings This Week: AA, BAC, DAL"
"APR 11, 2016",Stocks Trade Lower as Alcoa Starts Earnings Season
"APR 11, 2016","After Hours Most Active for Apr 11, 2016 : PFE, T, BAC, VZ, AAPL, QQQ, AA, ETP, YHOO, CLNE, MSFT, SYMC"
"APR 11, 2016","Earnings Reaction History: Alcoa Inc., 66.7% Follow-Through Indicator, 3.9% Sensitive"
"APR 11, 2016",Stocks Collapse on Low Earnings Expectations
"APR 11, 2016","3 Stocks to Watch on Monday: Alcoa Inc (AA), Apple Inc. (AAPL) and Wal-Mart Stores, Inc. (WMT)"
"APR 11, 2017",Steve Romick Reduces Alcoa Stake
"APR 11, 2018",Semtech (SMTC) Hits 52-Week High on Bullish Growth Trends
"APR 11, 2018",Amazon Extends Two-Hour Whole Foods Delivery Service to LA
"APR 11, 2018","PerkinElmer, Inc. (PKI) Ex-Dividend Date Scheduled for April 12, 2018"
"APR 11, 2018",Alcoa Corporation (AA) Looks Good: Stock Adds 6.8% in Session
"APR 11, 2018",Is Alcoa (AA) Set to Beat Q1 Earnings Estimates?
"APR 11, 2021","Weekly Preview: Earnings to Watch This Week (AA, PEP, JPM, WFC)"
"APR 11, 2022",Why Nordson (NDSN) is an Attractive Bet for Investors Now
"APR 11, 2022",iShares Core S&P Mid-Cap ETF Experiences Big Inflow
"APR 11, 2023",Flat Markets Bespeak Importance of CPI Data
"APR 11, 2023",Flat Markets Bespeak Importance of CPI Data
"APR 11, 2023",Market Awaits Consumer Price Index Numbers
"APR 11, 2023",Flat Markets Bespeak Importance of CPI Data
"APR 11, 2023",Market Awaits Consumer Price Index Numbers
"APR 11, 2023",Market Awaits Consumer Price Index Numbers
"APR 12, 2016",3 Stocks That Could Really Use an Earnings Beat
"APR 12, 2016",Mid-Afternoon Market Update: Crude Oil Up 4.5%; Horizon Pharma Shares Tumble
"APR 12, 2016",Close Update: Oil's Rally Fuels Triple-Digit Gains in Dow
"APR 12, 2016","Earnings Previews for Q1 Frontrunners: JPM, CSX and PGR"
"APR 12, 2016","Stock Futures Buoyed by Higher Oil, Shrugging Off Downbeat Alcoa Earnings"
"APR 12, 2016","3 Big Stock Charts for Tuesday: Bank of America Corp (BAC), Citigroup Inc (C) and General Motors Corporation (GM)"
"APR 12, 2016","Pre-Market Most Active for Apr 12, 2016 : SRC, AA, E, HQY, CHK, TVIX, BHP, QQQ, JNPR, QAT, FOLD, SBUX"
"APR 12, 2016","Alcoa's (AA) Q1 Earnings Top, Lower Prices Dent Profits"
"APR 12, 2016",Oil Gives Stocks a Lift Ahead of Bank Earnings
"APR 12, 2016","SunCoke Energy, Lindsay and Alcoa highlighted as Zacks Bull and Bear of the Day"
"APR 12, 2016",Mid-Morning Market Update: Markets Open Higher; Alcoa Revenue Misses Views
"APR 12, 2016","PerkinElmer, Inc. (PKI) Ex-Dividend Date Scheduled for April 13, 2016"
"APR 12, 2016","Tuesday's Vital Data: Alcoa Inc (AA), Chesapeake Energy Corporation (CHK) and Netflix, Inc. (NFLX)"
"APR 12, 2018",Here's Why You Should Hold on to Badger Meter (BMI) for Now
"APR 12, 2018",Qualcomm Arms IoT Devices With Vision Intelligence Platform
"APR 12, 2018",MKS Instruments Lowers Debt on Loan Repayment & Reprice
"APR 12, 2022",4 Testing Equipment Stocks to Escape a Challenging Industry
"APR 12, 2022",Alcoa (AA) Gains As Market Dips: What You Should Know
"APR 13, 2015","Monday 4/13 Insider Buying Report: JGH, AA"
"APR 13, 2015","The Zacks Analyst Blog Highlights: FedEx, Alcoa, Bed Bath & Beyond, Boeing and Apple - Press Releases"
"APR 13, 2015","The Zacks Analyst Blog Highlights: Alcoa, SPDR S&P Transportation ETF, iShares Dow Jones Transportation Average Fund, FedEx and First Trust NASDAQ Global Auto ETF - Press Releases"
"APR 13, 2016",What Investors Can Learn From the Masters
"APR 13, 2016",Dismal Earnings Outlook Projected for 1st Quarter
"APR 13, 2016","3 Big Stock Charts for Wednesday: Alcoa Inc (AA), JPMorgan Chase & Co. (JPM) and ConocoPhillips (COP)"
"APR 13, 2016",Alcoa Q1 Earnings: So Many Moving Parts
"APR 13, 2017",Alcoa (AA) Shares Cross Below 200 DMA
"APR 13, 2022",Dover (DOV) to Report Q1 Earnings: What's in the Cards?
"APR 13, 2022",Alcoa (AA) Earnings Expected to Grow: Should You Buy?
"APR 13, 2022","Zacks Industry Outlook Highlights Agilent Technologies, AMETEK, Fortive, and Cognex"
"APR 13, 2022",3 of the Best Momentum Stocks to Buy Using Driehaus Strategy
"APR 13, 2023",AA June 2nd Options Begin Trading
"APR 13, 2023",AA June 2nd Options Begin Trading
"APR 14, 2014",Wall Street braces for uncertain earnings season
"APR 14, 2014",S&P 500 Analyst Moves: A
"APR 14, 2014",Agilent Technologies Crosses Below Key Moving Average Level
"APR 14, 2014","Methode Electronics, Inc. (MEI) Ex-Dividend Date Scheduled for April 15, 2014"
"APR 14, 2015",eBay Appoints 3 New Executives Ahead of PayPal Spin-off - Analyst Blog
"APR 14, 2015",Two Alcoa directors buy more shares
"APR 14, 2015",3 Stocks Looking to Continue Winning Streaks This Earnings Season - Analyst Blog
"APR 14, 2021","Why Alcoa, United States Steel, and Freeport-McMoRan Stocks Surged Today"
"APR 14, 2021","Noteworthy Wednesday Option Activity: PMT, CRWD, AA"
"APR 14, 2022",Analysts Predict 21% Upside For PWB
"APR 14, 2022",Alcoa (AA) Gains As Market Dips: What You Should Know
"APR 14, 2022",3 Reasons Why Growth Investors Shouldn't Overlook Alcoa (AA)
"APR 14, 2022",Is a Surprise Coming for Alcoa (AA) This Earnings Season?
"APR 14, 2023","Noteworthy Friday Option Activity: APLS, AA, CELH"
"APR 14, 2023",What's in the Offing for Alcoa (AA) This Earnings Season?
"APR 14, 2023","Noteworthy Friday Option Activity: APLS, AA, CELH"
"APR 14, 2023",What's in the Offing for Alcoa (AA) This Earnings Season?
"APR 14, 2023",Alcoa (AA) Dips More Than Broader Markets: What You Should Know
"APR 14, 2023",Alcoa (AA) Dips More Than Broader Markets: What You Should Know
"APR 15, 2010",Stocks to Buy and Sell: Ratings for the Top 50 Tech Stocks
"APR 15, 2014","Tuesday 4/15 Insider Buying Report: FLXS, AA"
"APR 15, 2016",Better Buy: Alcoa Inc. vs. Freeport-McMoRan
"APR 15, 2016",What Alcoa Management's Outlook Means to Investors
"APR 15, 2016","Zacks Earnings Trends Highlights: J.P. Morgan, Alcoa and CSX"
"APR 15, 2018",The Earnings Beat: Four Stocks To Watch For the Coming Week
"APR 15, 2019",3 Fast-Growing Mid-Cap Tech Stocks
"APR 15, 2021",Alcoa (AA) 1st Quarter Earnings: What to Expect
"APR 15, 2021",Alcoa Corp. Q1 adjusted earnings Beat Estimates
"APR 15, 2021",Alcoa Q1 Profit Trumps Street View As Aluminum Shipments And Prices Rise
"APR 15, 2021",These 2 Earnings Reports Hold the Secret to the Stock Market's Future
"APR 15, 2021",Alcoa Corporation (AA) Q1 2021 Earnings Call Transcript
"APR 16, 2014",Why Alcoa (AA) Stock Might be a Great Pick - Tale of the Tape
"APR 16, 2016",Manning & Napier Exits Position in Apple
"APR 16, 2021",Why Alcoa Stock Just Popped
"APR 16, 2021","5 Top Stock Trades for Monday: BA, MS, WMT, AA, KO"
"APR 17, 2014","After Hours Most Active for Apr 17, 2014 : UMPQ, BAC, FB, AA, SGMS, QQQ, AMD, ITUB, PBR, RGEN, PBCT"
"APR 17, 2014","#PreMarket Primer: Thursday, April 17: Violence In Ukraine Could Deter Thursday's Negotiations"
"APR 17, 2017",S&P 500 Analyst Moves: A
"APR 17, 2019","Notable Wednesday Option Activity: FB, AA, EHTH"
"APR 17, 2019",Agilent Technologies Becomes Oversold (A)
"APR 17, 2019",Agilent Technologies Becomes Oversold (A)
"APR 17, 2019",Alcoa Posts Q1 Loss - Update
"APR 17, 2019","Alcoa (AA) Reports Q1 Loss, Misses Revenue Estimates"
"APR 17, 2019",Alcoa (AA) 1st Quarter Earnings: What to Expect
"APR 17, 2019","Earnings Reaction History: Alcoa Inc., 70.0% Follow-Through Indicator, 6.4% Sensitive"
"APR 17, 2019","Earnings Reaction History: Alcoa Inc., 70.0% Follow-Through Indicator, 6.4% Sensitive"
"APR 17, 2019","Notable Wednesday Option Activity: FB, AA, EHTH"
"APR 17, 2019",Alcoa Earnings: AA Stock Slides on Q1 EPS Miss
"APR 17, 2019",ALCOA CORP (AA) Q1 2019 Earnings Call Transcript
"APR 17, 2019",Alcoa Earnings: AA Stock Slides on Q1 EPS Miss
"APR 17, 2019",Alcoa Q1 19 Earnings Conference Call At 5:00 PM ET
"APR 17, 2019",Alcoa Inc. Q1 adjusted earnings of -$0.32 per share
"APR 17, 2019","After-Hours Earnings Report for April 17, 2019 : LVS, CCI, KMI, TEAM, ETFC, URI, TMK, CCK, SLG, AA, SLM, UMPQ"
"APR 17, 2022",Agilent Technologies Inc. Shares Near 52-Week Low - Market Mover
"APR 17, 2022","Weekly Preview: Earnings To Watch This Week (AA, IBM, NFLX, TSLA)"
"APR 17, 2023",What To Anticipate From Alcoa's Q1 Results?
"APR 17, 2023",What To Anticipate From Alcoa's Q1 Results?
"APR 18, 2013",Texas Instruments Lab at UC Berkeley - Analyst Blog
"APR 18, 2016",Peabody Energy's Bankruptcy: It's More Than Just the Coal Market
"APR 18, 2016",Interesting May Stock Options for AA
"APR 18, 2017",Arconic (ARNC) CEO Klaus Kleinfeld Quits Amid Proxy Battle
"APR 18, 2017",Berkshire Hathaway's HomeServices Strikes Marketing Deal with China Property Portal Juwai.com
"APR 18, 2018",Alcoa Corp (AA) Updates Guidance on Aluminum Supply Shortfall
"APR 18, 2018","Alcoa (AA) Posts Earnings Beat, Raises Full-Year EBITDA Guidance"
"APR 18, 2018","After-Hours Earnings Report for April 18, 2018 : AXP, CCI, KMI, CP, URI, STLD, AA, TMK, PTC, SLG, CCK, UMPQ"
"APR 18, 2018",Do Options Traders Know Something About Alcoa (AA) Stock We Don't?
"APR 18, 2018",Alcoa (AA) 1st Quarter Earnings: What to Expect
"APR 18, 2019",Stock Market News: Pier 1 Accelerates Store Closures; Alcoa Falls on Earnings
"APR 18, 2019","U.S. STOCKS ON THE MOVE-Alcoa, Blackstone, Pinterest, Starbucks, Sprint"
"APR 18, 2019","U.S. STOCKS ON THE MOVE-Honeywell, Alcoa, Mustang Bio, Las Vegas Sands"
"APR 18, 2019","U.S. STOCKS ON THE MOVE-Blackstone, Mustang Bio, Fortress, Snap, Skechers USA"
"APR 18, 2019","U.S. STOCKS ON THE MOVE-Union Pacific, Canopy Growth, Mustang Bio, Blackstone, Skechers USA"
"APR 18, 2019","U.S. STOCKS ON THE MOVE-Blackstone, Honeywell, Mustang Bio, Canopy Growth, Union Pacific"
"APR 18, 2019",Why Century Aluminum Stock Dropped Today
"APR 18, 2022",Will Strength in Aluminum Benefit Alcoa (AA) in Q1 Earnings?
"APR 18, 2022",Will Alumina and Bauxite Benefit Alcoa's (AA) Q1 Earnings?
"APR 18, 2022",Alcoa (AA) to Report Q1 Earnings: What's in the Offing?
"APR 18, 2023",GRAPHIC-Hefty shortages to help buoy aluminium prices this year
"APR 18, 2023",GRAPHIC-Hefty shortages to help buoy aluminium prices this year
"APR 19, 2013",Roper Expands in Medical Segment - Analyst Blog
"APR 19, 2017",7 Things You Didn't Know About Alcoa Corp.
"APR 19, 2018",Alcoa (AA) Q1 2018 Earnings Conference Call Transcript
"APR 19, 2018","Western Digital, Bed Bath & Beyond and Alcoa highlighted as Zacks Bull and Bear of the Day"
"APR 19, 2018",Earnings Confirm Alcoa Corp Is in a Sweet Spot
"APR 19, 2019",Top Gene-Sequencing Stocks for 2019
"APR 19, 2021",Alcoa Delivers Record 1Q Results As Higher Aluminum Prices Fuel Sales
"APR 19, 2022",iShares Core S&P Mid-Cap ETF Experiences Big Outflow
"APR 19, 2022",Interesting A Put And Call Options For June 17th
"APR 19, 2023","Alcoa (AA) Reports Q1 Loss, Tops Revenue Estimates"
"APR 19, 2023",Alcoa Q1 23 Earnings Conference Call At 5:00 PM ET
"APR 19, 2023","Alcoa (AA) Reports Q1 Loss, Tops Revenue Estimates"
"APR 19, 2023",Alcoa Corp. Q1 Earnings Summary
"APR 19, 2023",Alcoa Q1 23 Earnings Conference Call At 5:00 PM ET
"APR 19, 2023",Alcoa Corp. Q1 Earnings Summary
"APR 2, 2013","Park Electrochemical Corporation (PKE) Ex-Dividend Date Scheduled for April 03, 2013"
"APR 2, 2019","U.S. STOCKS ON THE MOVE-Airlines, Facebook, Walgreens, Lyft, Alcoa"
"APR 2, 2019","U.S. STOCKS ON THE MOVE-Facebook, Airlines, Dow, Walgreens, Crypto stocks"
"APR 2, 2020",Interesting AA Put And Call Options For May 22nd
"APR 20, 2016","After Alcoa Inc.'s Earnings, These 4 Industrials Could Disappoint"
"APR 20, 2017",Alcoa attracts some attention from option bulls
"APR 20, 2022",Alcoa (AA) Q1 Earnings Top Estimates
"APR 20, 2022",Alcoa Q1 Profit Beats Street View
"APR 20, 2022","Alcoa Corp. Q1 Profit Increases, beats estimates"
"APR 20, 2022","After-Hours Earnings Report for April 20, 2022 : TSLA, CCI, CSX, LRCX, KMI, EFX, STLD, AA, UAL, THC, CVNA, FR"
"APR 20, 2022",5 Must-Buy High-Beta Stocks Flying High in a Volatile Market
"APR 20, 2022",Alcoa Q1 22 Earnings Conference Call At 5:00 PM ET
"APR 20, 2023",BMO Capital Maintains Alcoa (AA) Market Perform Recommendation
"APR 20, 2023",BMO Capital Maintains Alcoa (AA) Market Perform Recommendation
"APR 20, 2023",Guru Fundamental Report for AA
"APR 20, 2023",Guru Fundamental Report for AA
"APR 21, 2014",Alcoa Strikes New 52-Week High - Analyst Blog
"APR 21, 2014","Notable ETF Inflow Detected - RPV, AA, WLP, VLO"
"APR 21, 2016",Highlights From Alcoa Inc's Q1 Earnings
"APR 21, 2016",A New ETF That Capitalizes on Social Media $BUZ
"APR 21, 2021",What's Behind 14% Rise In Alcoa Stock In A Week?
"APR 21, 2022",AA June 3rd Options Begin Trading
"APR 21, 2022",Why Alcoa Stock Is Crashing Today
"APR 21, 2022","Pre-market Movers: RDBX, IGIC, ESPR, EFX, CRXT…"
"APR 21, 2022",Wall St ends down as Powell plops 50 bps rate hike on table
"APR 21, 2022","Daily Markets: Pace of Earnings Accelerates, Powell and Lagarde on Deck"
"APR 21, 2023",B. Riley Securities Maintains Alcoa (AA) Neutral Recommendation
"APR 21, 2023",COLUMN-Aluminium's fortunes tied to Yunnan weather forecast: Andy Home
"APR 21, 2023",B. Riley Securities Maintains Alcoa (AA) Neutral Recommendation
"APR 21, 2023","Friday Sector Laggards: Metals & Mining, Non-Precious Metals & Non-Metallic Mining Stocks"
"APR 21, 2023","Friday Sector Laggards: Metals & Mining, Non-Precious Metals & Non-Metallic Mining Stocks"
"APR 21, 2023",COLUMN-Aluminium's fortunes tied to Yunnan weather forecast: Andy Home
"APR 22, 2020",Alcoa Q1 20 Earnings Conference Call At 5:00 PM ET
"APR 22, 2020",Alcoa Corp. Q1 adjusted earnings Beat Estimates
"APR 22, 2022",Alcoa Stock Getting Very Oversold
"APR 22, 2022","Friday's ETF Movers: MCHI, PICK"
"APR 22, 2022","Company News for Apr 22, 2022"
"APR 22, 2022",Should iShares MSCI USA SmallCap Multifactor ETF (SMLF) Be on Your Investing Radar?
"APR 23, 2012",Roper Beats Estimates - Analyst Blog
"APR 23, 2018",Trade of the Day: Alcoa Corp Travels Too Far Too Fast
"APR 23, 2018","Close Update: U.S. Stocks Waver as Investors Watch Bond Yields, Earnings"
"APR 23, 2018",5 Top Stock Trades for Tuesday Morning
"APR 23, 2018",What Happened in the Stock Market Today
"APR 23, 2018","Monday's ETF Movers: MLPA, XME"
"APR 23, 2018",Can a Diverse Portfolio Lift Maxim's (MXIM) Earnings in Q3?
"APR 23, 2018","Monday Sector Laggards: Precious Metals, Metals Fabrication & Products"
"APR 23, 2018",Is a Beat in the Cards for Fortive (FTV) in Q1 Earnings?
"APR 23, 2018",Why Alcoa Corp.'s Stock Is Slumping Today
"APR 23, 2020","BUZZ-U.S. STOCKS ON THE MOVE-Aytu BioScience, QEP Resources, Immunomedics"
"APR 23, 2020","BUZZ-U.S. STOCKS ON THE MOVE-Immunomedics, Helix Energy, Sleep Number Corp"
"APR 23, 2020",Alcoa Corporation (AA) Q1 2020 Earnings Call Transcript
"APR 23, 2020",Agilent Gets FDA Approval For PD-L1 Companion Diagnostic On Dako Omnis
"APR 23, 2020","BUZZ-U.S. STOCKS ON THE MOVE-Sleep Number, Crocs, Cassava Sciences"
"APR 23, 2020",Interesting AA Put And Call Options For June 5th
"APR 23, 2020","BUZZ-U.S. STOCKS ON THE MOVE-Expedia Group, Crocs, Enzo Biochem"
"APR 24, 2012",Waters Posts Disappointing 1Q - Analyst Blog
"APR 24, 2016",What Investors Should Know About Alcoa Inc.'s Spinoff
"APR 24, 2017","One Put, One Call Option To Know About for Alcoa"
"APR 24, 2017",Alcoa Corp. (AA) Stock Up on Q1 Earnings Beat
"APR 24, 2017","Earnings Reaction History: Alcoa Inc., 75.0% Follow-Through Indicator, 14.5% Sensitive"
"APR 24, 2018",7 'Strong Buy' Stocks Bloggers Are Raving About
"APR 24, 2018",Buy Freeport-McMoRan Inc on the Post-Earnings Dip
"APR 24, 2018",Is a Beat in the Cards for KLA-Tencor (KLAC) in Q3 Earnings?
"APR 24, 2018",Expedia's (EXPE) Q1 Earnings May Reflect Core OTA Weakness
"APR 24, 2018","Noteworthy Tuesday Option Activity: FB, A, DE"
"APR 24, 2019",YieldBoost Agilent Technologies From 0.9% To 5.9% Using Options
"APR 24, 2020",Earnings Highlight the Core Problem With Alcoa Stock
"APR 24, 2023","Notable Monday Option Activity: RETA, AA, FOXA"
"APR 24, 2023",New Strong Sell Stocks for April 24th
"APR 24, 2023",New Strong Sell Stocks for April 24th
"APR 24, 2023","Notable Monday Option Activity: RETA, AA, FOXA"
"APR 25, 2014","Freeport's Q1 Earnings Top, Profit Falls - Analyst Blog"
"APR 25, 2014",Itron Beats Q1 Earnings Estimates - Analyst Blog
"APR 25, 2015",10 Most Profitable Companies in Commodities
"APR 25, 2016",Will Ametek (AME) Earnings Surpass Estimates in Q1?
"APR 25, 2016",Can Garmin (GRMN) Pull Off a Surprise in Q1 Earnings?
"APR 25, 2016","Monday 4/25 Insider Buying Report: UAL, AA"
"APR 25, 2017","How Does Oil and Gas Fracking Work, Exactly?"
"APR 25, 2017",Alcoa's Q1 2017 Earnings Review: Favorable Pricing Environment Translates Into Earnings Growth
"APR 25, 2017",Why Alcoa Stock Jumped 9% Today
"APR 25, 2017","3 Stocks to Watch on Tuesday: Alcoa Corp (AA), Caterpillar Inc. (CAT) and Express Scripts Holding Company (ESRX)"
"APR 25, 2017",Why Constellium Stock Just Jumped Nearly 9%
"APR 25, 2018",Will Amkor (AMKR) Q1 Earnings Gain From Strong Auto Demand?
"APR 25, 2018",Validea Kenneth Fisher Strategy Daily Upgrade Report - 4/25/2018
"APR 25, 2018",What's in the Offing for Nielsen (NLSN) in Q1 Earnings?
"APR 25, 2019",How The Pieces Add Up: FNK Headed For $41
"APR 25, 2022","Sonoco (SON) Q1 Earnings Surpass Estimates, Raises View"
"APR 25, 2022","After Plunging 26.7% in 4 Weeks, Here's Why the Trend Might Reverse for Alcoa (AA)"
"APR 25, 2022","Alcoa Stock: High-Need Commodity, Easy to Like"
"APR 25, 2022",Analysts See 10% Upside For IYM
"APR 25, 2022",Agilent Technologies Inc. Shares Fall 0.2% Below Previous 52-Week Low - Market Mover
"APR 25, 2023",AA Crosses Critical Technical Indicator
"APR 25, 2023",Morgan Stanley Maintains Alcoa (AA) Equal-Weight Recommendation
"APR 25, 2023",AA Crosses Critical Technical Indicator
"APR 25, 2023",Morgan Stanley Maintains Alcoa (AA) Equal-Weight Recommendation
"APR 26, 2012",Down-Under Energy Opportunities: Ivor Ries
"APR 26, 2016","Buy Alcoa Stock, Profit 50%? 3 Things to Know About Alcoa's New Buy Rating"
"APR 26, 2017",The Sudden Departure of Klaus Klienfeld from Arconic
"APR 26, 2017","Arconic (ARNC) Q1 Earnings & Sales Top, Shares Jump"
"APR 26, 2017",The Sudden Departure of Klaus Kleinfeld From Arconic
"APR 26, 2018",First Data (FDC) Q1 Earnings: A Disappointment in Store?
"APR 26, 2018","Notable ETF Inflow Detected - XME, NEM, RGLD, AA"
"APR 26, 2022","Packaging Corp (PKG) Q1 Earnings & Sales Top Estimates, Up Y/Y"
"APR 26, 2022","Avery Dennison (AVY) Tops Q1 Earnings Estimates, Ups '22 View"
"APR 26, 2022",3M's (MMM) Earnings and Revenues Surpass Estimates in Q1
"APR 26, 2022","General Electric (GE) Q1 Earnings Top Estimates, Revenues Miss"
"APR 26, 2022","O-I Glass' (OI) Q1 Earnings Beat Estimates, Ups '22 Guidance"
"APR 27, 2015",DJIA Index Slips 42 Points Ahead of Fed Meeting
"APR 27, 2016","After Hours Most Active for Apr 27, 2016 : FB, QQQ, ETE, MSFT, BSBR, JD, AAPL, CSCO, FBR, BAC, AA, PFE"
"APR 27, 2016",Brown Forman Acquires The BenRiach Distillery Company For $415.3 Mln
"APR 27, 2017",Alcoa Corp.'s Earnings Show Progress Toward the Future
"APR 27, 2018",Fortive's (FTV) Q1 Earnings and Revenues Beat Estimates
"APR 27, 2018",Is a Beat in the Cards for Seagate (STX) in Q3 Earnings?
"APR 27, 2018",Expedia (EXPE) Beats Earnings and Revenue Estimates in Q1
"APR 27, 2022",John Bean (JBT) Revenues and Earnings Beat Estimates in Q1
"APR 27, 2022","Crown Holdings (CCK) Q1 Earnings & Sales Top Estimates, Up Y/Y"
"APR 27, 2023",Japan buyers agree to pay Q2 aluminium premiums of $125-$130/T -sources
"APR 27, 2023","'Load Up,' Says Goldman Sachs About These 3 Metal Stocks"
"APR 27, 2023",June 9th Options Now Available For Alcoa (AA)
"APR 27, 2023",June 9th Options Now Available For Alcoa (AA)
"APR 27, 2023",Japan buyers agree to pay Q2 aluminium premiums of $125-$130/T -sources
"APR 27, 2023","'Load Up,' Says Goldman Sachs About These 3 Metal Stocks"
"APR 28, 2016",What's in Store for Chegg (CHGG) this Earnings Season?
"APR 28, 2016",Harris Corp (HRS) Q3 Earnings: Can the Stock Surprise?
"APR 28, 2021","Agilent Technologies, Inc.'s (NYSE:A) Stock Is Going Strong: Is the Market Following Fundamentals?"
"APR 28, 2022",A. O. Smith's (AOS) Q1 Earnings & Revenues Top Estimates
"APR 28, 2022","Grainger (GWW) Earnings & Sales Beat Estimates in Q1, Up Y/Y"
"APR 28, 2022","2 Reasons to Buy Thermo Fisher Scientific, and 1 Reason to Sell"
"APR 29, 2013","ABB Ltd (ABB) Ex-Dividend Date Scheduled for April 30, 2013"
"APR 29, 2013",Itron Misses Earnings Est. in 1Q - Analyst Blog
"APR 29, 2016",Motorola Solutions (MSI) Q1 Earnings: A Surprise in Store?
"APR 29, 2021",June 11th Options Now Available For Alcoa (AA)
"APR 29, 2022","Stanley Black (SWK) Q1 Earnings Top Estimates, Revenues Miss"
"APR 29, 2022",Honeywell's (HON) Q1 Earnings & Revenues Beat Estimates
"APR 29, 2022","Silgan (SLGN) Q1 Earnings & Sales Top Estimates, Hikes '22 View"
"APR 29, 2022",5 Stocks to Buy At Lucrative Valuation After April Mayhem
"APR 3, 2017",Better Buy: Alcoa Corp. vs. Silver Wheaton Corp.
"APR 30, 2014",Westlake Fly High on Ethylene Unit IPO Plans - Analyst Blog
"APR 30, 2014","Others Overlooked Alcoa (AA), Should You Buy It Now? - Tale of the Tape"
"APR 30, 2018",AMETEK (AME) Warms Up to Q1 Earnings: What's in the Offing?
"APR 30, 2018",WESCO's (WCC) Earnings and Revenues Beat Estimates in Q1
"APR 30, 2018",Can Solid GPV Growth to Boost Square (SQ) in Q1 Earnings?
"APR 30, 2021",Should Shareholders Reconsider Alcoa Corporation's (NYSE:AA) CEO Compensation Package?
"APR 30, 2021",EXCLUSIVE-Bundesbank expects chip bottlenecks in German industry to worsen in Q2
"APR 30, 2021","Notable ETF Inflow Detected - XME, AA, ATI, CLF"
"APR 4, 2014",Will Q1 Earnings Be the Low Point for the Year? - Earnings Preview
"APR 4, 2018","Agilent to Acquire Lasergen for $105M, Strengthens Portfolio"
"APR 4, 2018",Is Starbucks Corporation (SBUX) Stock a Buy?
"APR 4, 2019","After Hours Most Active for Apr 4, 2019 : BAC, SKY, VALE, PM, A, SEE"
"APR 4, 2022",Top 5 Momentum Picks for April After Markets Rebound in March
"APR 4, 2023",Unusual Put Option Trade in Alcoa (AA) Worth $421.36K
"APR 4, 2023",Unusual Put Option Trade in Alcoa (AA) Worth $421.36K
"APR 4, 2023",Unusual Put Option Trade in Alcoa (AA) Worth $421.36K
"APR 5, 2013",Econ Data Turns Market Bearish - Earnings Preview
"APR 5, 2013",April Market Strategy Summary - Analyst Blog
"APR 5, 2016",Oil Gets Lit Up Again
"APR 5, 2016","Alcoa, FedEx and Nike are part of Zacks Earnings Preview"
"APR 5, 2021",This 1 Thing Will Make or Break the Stock Market Rally
"APR 5, 2022",Some Japanese buyers agree Q2 aluminium premium of $172/T -sources
