Date,Headline
"MAY 2, 2018",The Evolving Debate Over EIP-999: Can (or Should) Trapped Ether Be Freed?
"MAY 2, 2020",2 Investing Tricks to Double Your Money
"MAY 2, 2022",Alcoa (AA) is an Incredible Growth Stock: 3 Reasons Why
"MAY 2, 2022","The Zacks Analyst Blog Highlights Tesla, Pool, Alcoa, Zebra Technologies and SVB Financial Group"
"MAY 20, 2013",Itron Teams Up with Choice - Analyst Blog
"MAY 20, 2015",What Is the S&P 500 Index?
"MAY 20, 2018",Robinhood: The High Price of Free Stock Trades
"MAY 20, 2019",Alcoa (AA) Shares Enter Oversold Territory
"MAY 20, 2021",One global aluminium producer seeks Q3 premiums of $185/T - sources
"MAY 20, 2021",July 16th Options Now Available For Agilent Technologies (A)
"MAY 20, 2021",Alcoa gets Australian grant for process to cut alumina emissions
"MAY 20, 2022",What's in the Cards for Agilent Technologies' (A) Q2 Earnings?
"MAY 21, 2014","#PreMarket Primer: Wednesday, May 21: Russian Troops Leave Ukrainian Border"
"MAY 21, 2014","Allied Motion Technologies, Inc. (AMOT) Ex-Dividend Date Scheduled for May 22, 2014"
"MAY 21, 2014",Josh Brown: Avoid Small Caps Entirely - Real Time Insight
"MAY 21, 2020",Agilent Technologies Q2 adjusted earnings Beat Estimates
"MAY 21, 2020",Agilent Technologies Q2 20 Earnings Conference Call At 4:30 PM ET
"MAY 21, 2020",July 2nd Options Now Available For Alcoa (AA)
"MAY 21, 2021",I Built A List Of Growing Companies And Agilent Technologies (NYSE:A) Made The Cut
"MAY 22, 2013",Itron Renews Contract with British Gas - Analyst Blog
"MAY 22, 2014",Agilent Technologies Takes Over #228 Spot From Keurig Green Mountain
"MAY 22, 2017","After-Hours Earnings Report for May 22, 2017 : A, NDSN, LXFT, RAVN, QTNT, CRMT"
"MAY 22, 2018",S&P 500 Analyst Moves: A
"MAY 22, 2020","S&P 500 Movers: HPE, A"
"MAY 22, 2020",Stock Alert: Agilent Technologies Rises On Quarterly Results
"MAY 22, 2020",Agilent Technologies Inc (A) Q2 2020 Earnings Call Transcript
"MAY 22, 2020",Friday's ETF with Unusual Volume: SUSL
"MAY 22, 2020","BUZZ-U.S. STOCKS ON THE MOVE-Abbott, Tetraphase Pharma, HPE"
"MAY 23, 2016","Pre-Market Most Active for May 23, 2016 : XNPT, MON, LBTYK, ING, TVIX, DCM, AAPL, LBTYA, AA, ACAS, AZN, SDRL"
"MAY 23, 2017","Mid-Day Update: U.S. Stocks Mostly Firm in Lackluster Trade After Mixed U.S. Data, Bombing in Manchester"
"MAY 23, 2017","S&P 500 Movers: AZO, A"
"MAY 23, 2017","U.S. Stocks Mostly Firm At Mid-day But Trade Subdued After Manchester Attack, Mixed U.S. Data"
"MAY 23, 2017","3 Big Stock Charts for Tuesday: AutoZone, Inc. (AZO), ArcelorMittal SA (ADR) (MT) and Agilent Technologies Inc (A)"
"MAY 23, 2017",Agilent Technologies (A) Beats on Q2 Earnings & Revenues
"MAY 23, 2019","Commit To Buy Alcoa Corporation At $15, Earn 7.7% Using Options"
"MAY 23, 2022",XRP vs. Alcoa: Price Relationship Crosses Threshold
"MAY 24, 2016",Strategy To YieldBoost Agilent Technologies To 6% Using Options
"MAY 24, 2017","RBC Says Brown Forman, Constellation Brands Deal Not Likely to Create Value; Sees Alternative Scenario"
"MAY 24, 2017","Company News for May 24, 2017"
"MAY 24, 2017",MKS Instruments Ranked Strong Buy on Healthy Growth Drivers
"MAY 24, 2018",Agilent's (A) Latest Buyout to Bolster Presence in Korea
"MAY 24, 2022",Agilent Technologies Announces Increase In Q2 Income
"MAY 24, 2022",Agilent Technologies (A) Q2 Earnings Beat Estimates
"MAY 24, 2022",COLUMN-Europe's aluminium output slides as energy crunch bites: Andy Home
"MAY 24, 2022",COLUMN-Europe's aluminium output slides as energy crunch bites: Andy Home
"MAY 24, 2022","After-Hours Earnings Report for May 24, 2022 : INTU, A, TOL, SBLK, JWN, QFIN, URBN, RAMP, CAL, VNET, GRIN, ARCE"
"MAY 25, 2017","Itron Inks Deal to Lower Water Losses in Sao Paulo, Brazil"
"MAY 25, 2018",Ask a Fool: How Much Riskier Are Lower-Rated Bonds?
"MAY 25, 2018",Ask a Fool: How Much Riskier Are Lower-Rated Bonds?
"MAY 25, 2021","After-Hours Earnings Report for May 25, 2021 : INTU, A, ZS, TOL, HEI, JWN, URBN, RAMP, VNET, SKY, RRGB, CSWC"
"MAY 25, 2021",4 Top Tech Stocks To Watch Right Now
"MAY 25, 2021",Agilent Technologies Inc (A) Q2 2021 Earnings Call Transcript
"MAY 25, 2022",Agilent Technologies (A) Q2 2022 Earnings Call Transcript
"MAY 25, 2022",Top Stocks To Watch Right Now? 3 Tech Stocks In Focus
"MAY 25, 2022","Agilent (A) Q2 Earnings Surpass Estimates, Revenues Rise Y/Y"
"MAY 25, 2022",7 Undervalued Blue-Chip Stocks to Buy for June
"MAY 25, 2023",Alcoa (AA) Stock Sinks As Market Gains: What You Should Know
"MAY 25, 2023",Alcoa (AA) Stock Sinks As Market Gains: What You Should Know
"MAY 26, 2016","Baker Hughes Incorporated (BHI) Ex-Dividend Date Scheduled for May 27, 2016"
"MAY 26, 2022","Company News for May 26, 2022"
"MAY 26, 2022",The Implied Analyst 12-Month Target For IVOG
"MAY 26, 2022",FOCUS-Silver Lake's backing of dealmaking CEOs pays off
"MAY 26, 2022",What Makes Agilent (A) a New Buy Stock
"MAY 26, 2022",Quant Ratings Updated on 75 Stocks
"MAY 26, 2022",July 8th Options Now Available For Alcoa (AA)
"MAY 26, 2023",Global aluminium producer seeks Q3 premium of $165/T from Japan buyers -sources
"MAY 26, 2023",Global aluminium producer seeks Q3 premium of $165/T from Japan buyers -sources
"MAY 27, 2020","Why Alcoa, Century Aluminum, and Tronox Stocks Jumped at Least 10% Today"
"MAY 27, 2020","Ackman says hedge fund up 27% year to date, dumped Berkshire"
"MAY 27, 2021",Alcoa Stock Sheds 10% Of Its Value Within A Week – Here's Why
"MAY 27, 2022",5 ETF Areas to Gain From Memorial Day 2022 & After
"MAY 28, 2013","AVX Corporation (AVX) Ex-Dividend Date Scheduled for May 29, 2013"
"MAY 28, 2015",Insiders Now Seeing Red With AA At New 52-Week Low
"MAY 28, 2020",Alcoa considering more than 500 layoffs at Spanish plant
"MAY 28, 2020",Alcoa considering more than 500 layoffs at Spanish plant
"MAY 28, 2021",AA Crosses Above Average Analyst Target
"MAY 29, 2014",Westlake Chemical Scoops up Vinnolit - Analyst Blog
"MAY 29, 2017",What's in the Offing for Palo Alto (PANW) in Q3 Earnings?
"MAY 29, 2018",Alcoa Breaks Below 200-Day Moving Average - Notable for AA
"MAY 3, 2016","Zacks Industry Outlook Highlights: BHP Billiton, Rio Tinto, Vale, Alcoa and Freeport-McMoRan"
"MAY 3, 2016","Alcoa Inc. (AA) Ex-Dividend Date Scheduled for May 04, 2016"
"MAY 3, 2016","Under Armour Inc: Join the Club, UA — China's Ripping You Off!"
"MAY 3, 2016",What Awaits Telephone & Data Systems (TDS) Q1 Earnings?
"MAY 3, 2017",7 Stocks to Sell Thanks to TERRIBLE Seasonality
"MAY 3, 2022",Ametek (AME) Tops Q1 Earnings Estimates
"MAY 3, 2022",Should SPDR S&P MidCap 400 ETF (MDY) Be on Your Investing Radar?
"MAY 3, 2022",Rockwell Automation (ROK) Q2 Earnings & Sales Miss Estimates
"MAY 3, 2022",3 High Beta Stocks that Could Rocket When the Market Rallies
"MAY 3, 2022","Sealed Air (SEE) Q1 Earnings Top Estimates, Raises FY22 View"
"MAY 30, 2012",Agilent Launches New Oscilloscope - Analyst Blog
"MAY 30, 2014",Alcoa to Produce Jet Engine Parts in Indiana - Analyst Blog
"MAY 30, 2014",Waste Management Looks To Avoid Waste
"MAY 30, 2017",Better Buy: Alcoa Inc. vs. Freeport-McMoRan
"MAY 30, 2021",Alcoa Corporation's (NYSE:AA) Intrinsic Value Is Potentially 94% Above Its Share Price
"MAY 30, 2023",AA Stock Crowded With Sellers
"MAY 30, 2023",AA Stock Crowded With Sellers
"MAY 31, 2017","Bruker Corporation (BRKR) Ex-Dividend Date Scheduled for June 01, 2017"
"MAY 31, 2018","HP Inc Stock Is Priced for Low Growth, But Poised for Innovation"
"MAY 31, 2018","Will Trump's Resolve Finally Help US Steel, Aluminum Makers?"
"MAY 31, 2022",Agilent (A) to Attract Biopharma Customers With APC Tie-Up
"MAY 31, 2022",Here's Why Agilent Technologies (A) is a Strong Momentum Stock
"MAY 31, 2022",Here is What to Know Beyond Why Alcoa (AA) is a Trending Stock
"MAY 31, 2022",Earnings Growth & Price Strength Make Agilent Technologies (A) a Stock to Watch
"MAY 31, 2023","Pre-Market Most Active for May 31, 2023 : AI, SQQQ, TQQQ, PLTR, SOFI, TSLA, NVDA, AAL, NIO, TAL, BBAI, AAP"
"MAY 31, 2023","Pre-Market Most Active for May 31, 2023 : AI, SQQQ, TQQQ, PLTR, SOFI, TSLA, NVDA, AAL, NIO, TAL, BBAI, AAP"
"MAY 4, 2015",DJIA Index Gains 46 Points as Healthcare Stocks Jump
"MAY 4, 2016",What's in Store for Gogo Inc. (GOGO) this Earnings Season?
"MAY 4, 2016","Zacks Industry Outlook Highlights: Alcoa, Boeing and Lockheed Martin"
"MAY 4, 2016",What's in the Cards for Web.com (WEB) in Q1 Earnings?
"MAY 4, 2016",Liberty Interactive (QVCA) Poised to Beat on Q1 Earnings
"MAY 4, 2018","Mettler-Toledo (MTD) Q1 Earnings Lag Estimates, Revenues Top"
"MAY 4, 2018","XME, AA, RGLD, NEM: Large Outflows Detected at ETF"
"MAY 4, 2020",We Did The Math FTCS Can Go To $60
"MAY 4, 2020",Shell Knows It's a Zombie as Long as It Focuses on Fossil Fuels
"MAY 4, 2022",Should Schwab U.S. SmallCap ETF (SCHA) Be on Your Investing Radar?
"MAY 4, 2022",Is iShares MSCI USA SmallCap Multifactor ETF (SMLF) a Strong ETF Right Now?
"MAY 4, 2022","Wolfspeed (WOLF) Reports Q3 Loss, Misses Revenue Estimates"
"MAY 4, 2022",Is Most-Watched Stock Alcoa (AA) Worth Betting on Now?
"MAY 4, 2022","Amcor (AMCR) Q3 Earnings Beat Estimates, Raises FY22 View"
"MAY 4, 2022","Timken (TKR) Earnings & Sales Surpass Estimates in Q1, Up Y/Y"
"MAY 4, 2022","AGCO Corp (AGCO) Q1 Earnings & Sales Top Estimates, Up Y/Y"
"MAY 4, 2023",Guru Fundamental Report for AA
"MAY 4, 2023",AA June 23rd Options Begin Trading
"MAY 4, 2023",Guru Fundamental Report for AA
"MAY 4, 2023",AA June 23rd Options Begin Trading
"MAY 5, 2015",Metals & Mining Stock Outlook - May 2015 - Zacks Analyst Interviews
"MAY 5, 2015",Metals & Mining Stock Outlook - May 2015 - Industry Outlook
"MAY 5, 2016",What's in the Cards for Model N (MODN) in Q2 Earnings?
"MAY 5, 2016",Will Q1 Earnings Be a Disappointment for Nokia (NOK) Stock?
"MAY 5, 2016",What to Expect from Dun & Bradstreet's (DNB) Q1 Earnings?
"MAY 5, 2016",What's in Store for Stratasys (SSYS) this Earnings Season?
"MAY 5, 2020",How to Handle Spinoff Shares
"MAY 5, 2022","Ball Corp (BLL) Q1 Earnings Miss, Sales Beat Estimates, Up Y/Y"
"MAY 5, 2022",Cognex Corporation (CGNX) Q1 Earnings and Revenues Top Estimates
"MAY 5, 2023",Why Arconic Stock Zoomed This Week
"MAY 5, 2023",Why Arconic Stock Zoomed This Week
"MAY 6, 2014",Westlake Chemical's Q1 Earnings Beat Ests - Analyst Blog
"MAY 6, 2014",Industrial Metals Stock Outlook - May 2014 - Zacks Analyst Interviews
"MAY 6, 2014",Industrial Metals Stock Outlook - May 2014 - Industry Outlook
"MAY 6, 2014","Xcel Energy Now #276 Largest Company, Surpassing Alcoa"
"MAY 6, 2014","Teradyne, Inc. (TER) Ex-Dividend Date Scheduled for May 07, 2014"
"MAY 6, 2015","Alcoa Inc. (AA) Ex-Dividend Date Scheduled for May 07, 2015"
"MAY 6, 2015",What's Weighing on Industrial Metal Stocks? - Industry Outlook
"MAY 6, 2016","Friday's Vital Data: Weatherford International Plc (WFT), Alcoa Inc (AA) and Apple Inc. (AAPL)"
"MAY 6, 2016",S&P 500 Analyst Moves: A
"MAY 6, 2016",Berkshire Hathaway Q1 EPS Matches Expectations
"MAY 6, 2022","Manitowoc (MTW) Q1 Earnings Miss Estimates, Revenues Beat"
"MAY 6, 2023",Alcoa (AA) Declares $0.10 Dividend
"MAY 6, 2023",Alcoa (AA) Declares $0.10 Dividend
"MAY 7, 2014","CGI Group: Receivables Factoring, Cancelled Bookings, Insider Selling, And Organic Revenue Decline (Part 4)"
"MAY 7, 2014","Alcoa Inc. (AA) Ex-Dividend Date Scheduled for May 08, 2014"
"MAY 7, 2015","Zacks Industry Outlook Highlights: Alcoa, Ford Motor, General Motors, Fiat Chrysler Automobiles and RTI International Metals - Press Releases"
"MAY 7, 2018","Wayfair (W) Q1 Loss Wider Than Anticipated, Revenues Beat"
"MAY 7, 2018",Sempra Energy (SRE) Q1 2018 Earnings Conference Call Transcript
"MAY 7, 2020",COLUMN-Trump's tariff wall breached by rising tide of aluminium: Andy Home
"MAY 7, 2020",Why Alcoa Stock Jumped 32% in April
"MAY 7, 2020",AA June 26th Options Begin Trading
"MAY 7, 2020",COLUMN-Trump's tariff wall breached by rising tide of aluminium: Andy Home
"MAY 8, 2017","Arconic Closes Exchange of Alcoa Stock, Cuts $800M of Debt"
"MAY 8, 2018",Trimble's (TRMB) Q1 Earnings and Revenues Beat Estimates
"MAY 8, 2023","'Time to Buy,' Says J.P. Morgan About These Top Aluminum Stocks"
"MAY 8, 2023",JP Morgan Initiates Coverage of Alcoa (AA) with Overweight Recommendation
"MAY 8, 2023","'Time to Buy,' Says J.P. Morgan About These Top Aluminum Stocks"
"MAY 8, 2023",JP Morgan Initiates Coverage of Alcoa (AA) with Overweight Recommendation
"MAY 9, 2014",Retail Sector Earnings in Focus - Earnings Preview
"MAY 9, 2015",Can Biotech Save American Manufacturing?
"MAY 9, 2016",Why Have Aluminum Prices Declined Over The Past Year?
"MAY 9, 2022",AA Makes Notable Cross Below Critical Moving Average
"MAY 9, 2022",Is Alcoa (AA) Stock Outpacing Its Industrial Products Peers This Year?
"NOV 1, 2012","Best Mutual Fund Manager Edward Owens Buys 1 New Stock, Reports Holding Increases"
"NOV 1, 2016","Why L Brands, Brookdale Senior Living, and Arconic Slumped Today"
"NOV 1, 2016","After Hours Most Active for Nov 1, 2016 : YUMC, QCP, AA, GES, BAC, CSCO, PFE, AAPL, INTC, MENT, MSFT, GILD"
"NOV 1, 2017","Fujifilm (FUJIY) Q2 Earnings Up Y/Y, Revenues Top Estimates"
"NOV 1, 2017",Stocks With Rising Relative Strength: Rio Tinto
"NOV 1, 2019","Notable Friday Option Activity: A, ADSK, GD"
"NOV 1, 2019",Is Alcoa Giving Up on Aluminum?
"NOV 10, 2014",Earnings Estimates Moving Higher for Alcoa (AA): Time to Buy? - Tale of the Tape
"NOV 10, 2015","After Hours Most Active for Nov 10, 2015 : PYPL, BRCM, FCX, SIRI, CSCO, QCOM, GE, BAC, RY, STE, QQQ, AA"
"NOV 10, 2023",Interesting AA Put And Call Options For January 2026
"NOV 11, 2014",Alcoa Furthers Portfolio Transformation With Recent Business Developments
"NOV 11, 2015",Ametek Increases Share Repurchase Authorization by $350M
"NOV 11, 2021",Why Metals Stocks Are Red-Hot Today
"NOV 11, 2022","Why Alcoa, Chevron, and Freeport-McMoRan Stocks Sizzled on Friday"
"NOV 11, 2022","Noteworthy Friday Option Activity: KBH, AA, CHPT"
"NOV 11, 2022","Why Alcoa, Chevron, and Freeport-McMoRan Stocks Sizzled on Friday"
"NOV 11, 2022","Noteworthy Friday Option Activity: KBH, AA, CHPT"
"NOV 12, 2010",Opening View: DJIA Futures Fall on Fears of Chinese Interest-Rate Hike
"NOV 12, 2016",How Will a Trump Presidency Affect Alcoa Corporation?
"NOV 12, 2018",Agilent Technologies (A) Earnings Expected to Grow: Should You Buy?
"NOV 13, 2012","Agilent, Roche Sign Agreement - Analyst Blog"
"NOV 13, 2013",Impending Yellen Confirmation Boosts US Stocks
"NOV 13, 2015",What Lies Ahead for Agilent Technologies' (A) Q4 Earnings?
"NOV 13, 2017",Fujifilm (FUJIY) Invests ??170M on TOKIWA-Bio's Tech-License
"NOV 13, 2019","Notable Wednesday Option Activity: LII, WSM, A"
"NOV 13, 2020",Agilent Obtains Expanded FDA Approval For PD-L1 IHC 22C3 PharmDx In Triple-Negative Breast Cancer
"NOV 13, 2020","Notable Friday Option Activity: MTB, A, ROST"
"NOV 14, 2013",S&P 500 and Dow Jones Transportation Average: Bulls Cross the Line
"NOV 14, 2013",New Stock Coverage: Mattress Firm Holding Set to Sleep With the Fishes?
"NOV 14, 2013","Longs Eke Out Advantage Trading Agilent Post-Earnings, Shorts Still See Decent History"
"NOV 14, 2013","Earnings Reaction History: Agilent Technologies, Inc., 62.5% Follow-Through Indicator, 3.7% Sensitive"
"NOV 14, 2013","After-Hours Earnings Report for November 14, 2013 : AMAT, A, JWN, YOKU, HMIN, MATW, MTSC, KYTH, BONA, CO, LWAY, PFLT"
"NOV 14, 2014","Monsanto Sues Maui County, Assisted by Dow Chemical - Analyst Blog"
"NOV 14, 2014",Will Agilent Technologies (A) Miss Q4 Earnings Estimates? - Analyst Blog
"NOV 14, 2014",Zacks Rank #5 Additions for Friday - Tale of the Tape
"NOV 14, 2015",Seth Klarman Makes 3 Big Investments
"NOV 14, 2016",Electronics Stocks to Watch for Earnings on Nov 15: A & ACPW
"NOV 14, 2017","Itron Extends SMECO Contract, Offers Outsourced Solution"
"NOV 14, 2018",Alcoa (AA) Gains As Market Dips: What You Should Know
"NOV 15, 2011",Opening View: DJIA Braces for Another Drop Amid Escalating Concerns About Euro-Zone Debt
"NOV 15, 2013",Agilent Beats on Earnings in Q4 - Analyst Blog
"NOV 15, 2013","Littelfuse, Inc. (LFUS) Ex-Dividend Date Scheduled for November 18, 2013"
"NOV 15, 2013",Mid-Morning Market Update: Markets Rise; Nordstrom Posts Upbeat Profit
"NOV 15, 2016",Longs Hold Historical Advantage Trading Agilent Off Earnings-Driven After-Hours Moves
"NOV 15, 2016","After-Hours Earnings Report for November 15, 2016 : A, MTSI, FNJN"
"NOV 15, 2018",Will New Technologies Benefit Agilent (A) in Q4 Earnings?
"NOV 15, 2018","Daily Dividend Report: SU,A,FBP,RTN,CB"
"NOV 15, 2021",What Kind Of Investors Own Most Of Alcoa Corporation (NYSE:AA)?
"NOV 16, 2012","Cohu, Inc. (COHU) Ex-Dividend Date Scheduled for November 20, 2012"
"NOV 16, 2015","After-Hours Earnings Report for November 16, 2015 : A, NUAN, URBN, NORD, TGLS, LXFR, RLGT, UPLD, CERU, TTNP, STKS, AEMD"
"NOV 16, 2015","Earnings Reaction History: Agilent Technologies, Inc., 66.7% Follow-Through Indicator, 3.3% Sensitive"
"NOV 16, 2015",Agilent Maintains History of Supporting Long Trade in Wake of Earnings-Driven After-Hours Moves
"NOV 16, 2016","Agilent (A) Beats on Q4 Earnings & Revenues, Issues View"
"NOV 16, 2016","3 Stocks to Watch on Wednesday: Aclaris Therapeutics Inc (ACRS), Agilent Technologies Inc (A) and La-Z-Boy Incorporated (LZB)"
"NOV 16, 2016","S&P 500 Movers: MNK, TGT"
"NOV 16, 2017",Will New Technologies Help Agilent (A) Beat on Q4 Earnings?
"NOV 16, 2017","Daily Dividend Report: UNP, A, CDK, CB, RTN"
"NOV 17, 2014","Earnings Reaction History: Agilent Technologies, Inc., 66.7% Follow-Through Indicator, 4.4% Sensitive"
"NOV 17, 2014",Agilent Holds Bullish Next-Day Widening History for Longs and Shorts Trading Shares off After-Hours Earnings Reports
"NOV 17, 2015","Agilent Technologies Beats Q4 Earnings, Matches Revenues"
"NOV 17, 2017","Agilent Technologies Rewards Shareholders, Hikes Dividend"
"NOV 17, 2021",Alcoa To Participate In Goldman Sachs Global Metals & Mining Conference At 10:00 AM ET
"NOV 17, 2021",Alcoa Announces Transfer Of Approx. $1 Bln Of Pension Obligations - Quick Facts
"NOV 17, 2021",Alcoa Stock Above $50 – What's Behind This Surge?
"NOV 17, 2022",Russia's Rusal calls for LME to disclose origin of all metal stocks
"NOV 17, 2022",Russia's Rusal calls for LME to disclose origin of all metal stocks
"NOV 17, 2023",Industry group urges EU to impose broader sanctions on Russian aluminium
"NOV 17, 2023",Industry group urges EU to impose wider sanctions on Russian aluminium
"NOV 17, 2023",Industry group urges EU to impose wider sanctions on Russian aluminium
"NOV 17, 2023",Industry group urges EU to impose broader sanctions on Russian aluminium
"NOV 17, 2023",Industry group urges EU to impose wider sanctions on Russian aluminium
"NOV 17, 2023",Industry group urges EU to impose broader sanctions on Russian aluminium
"NOV 18, 2013","Company news for November 18, 2013 - Corporate Summary"
"NOV 18, 2013",Agilent Technologies (A) Catches Eye: Stock Jumps 8.7% - Tale of the Tape
"NOV 18, 2014",Mid-Morning Market Update: Markets Gain; Home Depot Earnings Top Street View
"NOV 18, 2014",Andersons Merges Turf & Specialty and Plant Nutrient Groups - Analyst Blog
"NOV 18, 2014","Mid-Day Market Update: SunEdison, TerraForm Jump On First Wind Acquisition; TJX Shares Drop"
"NOV 18, 2016","Daily Dividend Report: FDX, CB, PEP, NKE, A"
"NOV 18, 2021","Daily Dividend Report: LEA,NOC,BLK,A,HAL"
"NOV 19, 2012","After-Hours Earnings Report for November 19, 2012 : A, NUAN, URBN, BRCD, QIHU, JACK, BOBE, DY, KKD, SCVL, CRMT, PWRD"
"NOV 19, 2012",Inflation And Yields: The Dollar Equilibrium
"NOV 19, 2013","Cohu, Inc. (COHU) Ex-Dividend Date Scheduled for November 20, 2013"
"NOV 19, 2014",Allied Nevada Gold (ANV) in Focus: Stock Moves 22.2% Up - Tale of the Tape
"NOV 19, 2015","Pandora: Not Late To The Game, It Dictates The Game"
"NOV 19, 2016",Alcoa Corporation and Arconic Inc.: Why You Should (and Shouldn't) Buy
"NOV 19, 2018",Interesting A Put And Call Options For January 2019
"NOV 19, 2018",Agilent Technologies Inc (A) Q4 2018 Earnings Conference Call Transcript
"NOV 19, 2018","Agilent (A) Hikes Quarterly Dividend, Rewards Shareholders"
"NOV 19, 2018",Agilent Technologies (A) Q4 Earnings and Revenues Top Estimates
"NOV 19, 2018",Agilent Stock Surges on Q4 Earnings Beat
"NOV 19, 2018","Earnings Reaction History: Agilent Technologies, Inc., 55.6% Follow-Through Indicator, 3.4% Sensitive"
"NOV 19, 2018","After-Hours Earnings Report for November 19, 2018 : INTU, A, LB, NUAN, URBN, PSTG, JACK, BRKS, BECN, KLIC, LMB, GWGH"
"NOV 19, 2020","Daily Dividend Report: A,APD,LEA,AFL,ALL,NOC"
"NOV 2, 2012",What one bull is seeing in Agilent Tech
"NOV 2, 2015",Johnson Controls Executes Well in a Difficult Quarter
"NOV 2, 2015",Interesting December Stock Options for AA
"NOV 2, 2015",Fujifilm (FUJIY) Retains Scope for Growth Despite Risks
"NOV 2, 2015",Will Fidelity National (FIS) Pull a Surprise in Q3 Earnings?
"NOV 2, 2015",Will Tessera (TSRA) Surprise Earnings Estimates in Q3?
"NOV 2, 2017","Notable ETF Outflow Detected - XME, ATI, CNX, AA"
"NOV 2, 2018",Alcoa (AA) Gains As Market Dips: What You Should Know
"NOV 20, 2012",Agilent Sees Higher Profits; Beats Expectations (A)
"NOV 20, 2015","Daily Dividend Report: NKE, A, HD, PEP, UNP, YUM, APD, WMB, PPL"
"NOV 20, 2017","Dow, Nasdaq Head Early Gains; Verizon Upgraded, Cavium Surges"
"NOV 20, 2017","After-Hours Earnings Report for November 20, 2017 : INTU, A, PANW, VIPS, BECN, ZTO, URBN, CUB, RAVN, GBDC, ENTA, GLAD"
"NOV 20, 2017",Agilent Offers Bullish History for Longs Trading Shares off Earnings-Driven After-Hours Moves
"NOV 20, 2017",Why Is Alcoa (AA) Down 9.1% Since the Last Earnings Report?
"NOV 20, 2017","Trade of the Day: After Correcting, Alcoa Corp Offers Better Reward to Risk"
"NOV 20, 2018","S&P 500 Movers: REG, CPB"
"NOV 20, 2018",Agilent (A) Surpasses Earnings and Revenue Estimates in Q4
"NOV 20, 2018","Health Care Sector Update for 11/20/2018: INGN,ORPN,A,LIVN"
"NOV 20, 2018","Health Care Sector Update for 11/20/2018: A,ORPN"
"NOV 20, 2018",First Week of AA July 2019 Options Trading
"NOV 20, 2019",Here's Why Pacific Biosciences Gained as Much as 10.5% Today
"NOV 20, 2020",Is Danaher Stock a Buy?
"NOV 20, 2023",Implied MDYV Analyst Target Price: $76
"NOV 20, 2023",Implied MDYV Analyst Target Price: $76
"NOV 20, 2023",Implied MDYV Analyst Target Price: $76
"NOV 21, 2014","Daily Dividend Report: NKE, A, FLO, HD, UNP, FDX"
"NOV 21, 2014",3 Reasons Alcoa Inc. Stock Could Give Back Its Gains
"NOV 21, 2014",Insiders Seeing Green With Alcoa At New 52-Week High
"NOV 21, 2014",Alcoa (AA) Wraps Up $2.85B Firth Rixson Acquisition - Analyst Blog
"NOV 21, 2016",Agilent (A) to Reward Shareholders with 14.8% Dividend Hike
"NOV 21, 2017","Elliott Management Sells Alcoa, Exits LogMeIn, Nord Anglia Education"
"NOV 21, 2017",Agilent Technologies (A) Q4 2017 Earnings Conference Call Transcript
"NOV 21, 2017","3 Stocks to Watch on Tuesday: Agilent Technologies Inc (A), Palo Alto Networks Inc (PANW) and Urban Outfitters, Inc. (URBN)"
"NOV 21, 2017","Agilent (A) Beats on Q4 Earnings & Revenues, Lowers Guidance"
"NOV 21, 2017",Stocks Up Big As Apple Leads Dow; Is It Time To Buy This Top Internet Play?
"NOV 21, 2017",Alcoa (AA) Shares Enter Oversold Territory
"NOV 21, 2018",Agilent Technologies (A) in Focus: Stock Moves 7.8% Higher
"NOV 21, 2018",Alcoa (AA) Outpaces Stock Market Gains: What You Should Know
"NOV 21, 2018",Agilent (A) to Expand Cell Analysis Offerings in Ireland
"NOV 21, 2019",AA January 2020 Options Begin Trading
"NOV 21, 2019","Daily Dividend Report: A, SSNC, RE, GPI, CB, NOC"
"NOV 21, 2022",Alcoa backs Rusal's call for LME to reveal origin of all metal stocks
"NOV 21, 2022",Alcoa backs Rusal's call for LME to reveal origin of all metal stocks
"NOV 22, 2014",Solar is Disrupting the $2 Trillion Energy Industry: This CEO Tells You How
"NOV 22, 2015",Alcoa's Pending Split: What Can We Learn From Other CEO-Led Spinoffs
"NOV 22, 2017",Validea Peter Lynch Strategy Daily Upgrade Report - 11/22/2017
"NOV 22, 2021","After-Hours Earnings Report for November 22, 2021 : ZM, A, KEYS, ARWR, URBN, CENTA, ENTA, AFYA, CENT, CANG, IBEX, GNSS"
"NOV 22, 2021",Agilent Technologies Inc (A) Q4 2021 Earnings Call Transcript
"NOV 22, 2021",Agilent Technologies Q4 Profit Rises
"NOV 22, 2021","Noteworthy Monday Option Activity: BW, UNFI, A"
"NOV 22, 2021",Agilent Technologies Q4 21 Earnings Conference Call At 4:30 PM ET
"NOV 22, 2022","Notable Tuesday Option Activity: CF, MOS, AA"
"NOV 22, 2022","Notable Tuesday Option Activity: CF, MOS, AA"
"NOV 23, 2015","One Put, One Call Option To Know About for Alcoa"
"NOV 23, 2015",Alcoa's Split Gets a Big Vote of Confidence
"NOV 23, 2015",Agilent (A) to Reward Shareholders with 15% Dividend Hike
"NOV 23, 2020",Agilent Technologies Q4 20 Earnings Conference Call At 4:30 PM ET
"NOV 23, 2020",Agilent Technologies Q4 adjusted earnings Beat Estimates
"NOV 23, 2021","Health Care Sector Update for 11/23/2021: AADI, A, ARWR"
"NOV 23, 2022",January 2023 Options Now Available For Alcoa (AA)
"NOV 23, 2022",January 2023 Options Now Available For Alcoa (AA)
"NOV 23, 2023",Guru Fundamental Report for AA
"NOV 23, 2023",Guru Fundamental Report for AA
"NOV 23, 2023",Guru Fundamental Report for AA
"NOV 24, 2014",Alcoa's (AA) Shares Touch Fresh 52-Week High at $17.75 - Analyst Blog
"NOV 24, 2015",The Alcoa Break-Up: Who Gets the Debt?
"NOV 24, 2015",Alcoa (AA) Shares Rally on Elliott Management Stake Buy
"NOV 24, 2015",Dow Jones Futures Down 110 Points Ahead of a Busy Day of Data
"NOV 24, 2015","Company News for November 24, 2015"
"NOV 24, 2018",Alcoa's Relief From Aluminum Tariffs Might Hinge on Canadian Dairy
