Date,Headline
"FEB 16, 2016",Implied FTC Analyst Target Price: $52
"FEB 16, 2018",Agilent Technologies Shows Market Leadership With Jump To 83 RS Rating
"FEB 16, 2018","Steel, Aluminum Stocks Soar On Trump Tariff, Quota Recommendations"
"FEB 16, 2018",How Much Could Alcoa's Stock Grow in 2018?
"FEB 16, 2018","Noteworthy Friday Option Activity: EVC, AERI, AA"
"FEB 16, 2018",Why Century Aluminum Stock Popped 8% on Friday
"FEB 16, 2021",Agilent Technologies Q1 21 Earnings Conference Call At 4:30 PM ET
"FEB 16, 2021",Agilent Technologies Inc (A) Q1 2021 Earnings Call Transcript
"FEB 16, 2021",Agilent Technologies Q1 adjusted earnings Beat Estimates
"FEB 16, 2022",Ziff Davis (ZD) Earnings and Revenues Improve Y/Y in Q4
"FEB 16, 2022",New Strong Buy Stocks for February 16th
"FEB 16, 2022",Is Alcoa (AA) Outperforming Other Industrial Products Stocks This Year?
"FEB 16, 2022",Best Momentum Stocks to Buy for February 16th
"FEB 16, 2022","Upstart Holdings (UPST) Q4 Earnings Beat, Revenues Up Y/Y"
"FEB 16, 2022",Earnings Estimates Moving Higher for Alcoa (AA): Time to Buy?
"FEB 17, 2012",Agilent Reports In Line - Analyst Blog
"FEB 17, 2015","After-Hours Earnings Report for February 17, 2015 : DVN, VNO, ADI, FE, CF, A, O, XEC, FLS, RAX, FOSL, KAR"
"FEB 17, 2015",Agilent About Evenly Mixed in Post-Earnings Performance - Rewards Longs and Shorts in Next-Day Trade
"FEB 17, 2016",Agilent Technologies Tops Q1 Earnings & Revenue Estimates
"FEB 17, 2017",3 Stocks to Buy That Love This Strong Dollar
"FEB 17, 2017","An 11-Factor Heath, Jarrow And Morton Model For The Thai Government Bond Yield Curve: Implications For Model Validation"
"FEB 17, 2021","Agilent Technologies, Inc. Just Beat EPS By 19%: Here's What Analysts Think Will Happen Next"
"FEB 17, 2021","S&P 500 Movers: HSIC, A"
"FEB 17, 2022",The Trade Desk (TTD) Q4 Earnings and Revenues Top Estimates
"FEB 17, 2022",Relative Strength Alert For Agilent Technologies
"FEB 17, 2022",Alcoa Corporation and First Solar highlighted as Zacks Bull and Bear of the Day
"FEB 17, 2022",Bull of the Day: Alcoa Corp. (AA)
"FEB 17, 2022","Fastly (FSLY) Reports Q4 Loss, Tops Revenue Estimates"
"FEB 17, 2022","NVIDIA (NVDA) Q4 Earnings Beat Estimates, Revenues Surge Y/Y"
"FEB 17, 2022","Cisco's (CSCO) Q2 Earnings Top Estimates, Revenues Up Y/Y"
"FEB 18, 2013",Dissecting The Herbalife Trade: Did Spite Motivate Icahn's 13% Stake?
"FEB 18, 2014","Company news for February 18, 2014 - Corporate Summary"
"FEB 18, 2014",Agilent Technologies (A) in Focus: Stock Drops 8.0% - Tale of the Tape
"FEB 18, 2015",Agilent's Q1 Earnings & Revenues In Line with Estimates - Analyst Blog
"FEB 18, 2015","Winners, Losers from the Stronger U.S. Dollar"
"FEB 18, 2019",SEC to Review NYSE Arca Bitwise Bitcoin ETF Proposal
"FEB 18, 2019",Will New Technologies Benefit Agilent (A) in Q1 Earnings?
"FEB 18, 2020","Noteworthy Tuesday Option Activity: FSLR, A, ISRG"
"FEB 18, 2020",Agilent Technologies Inc (A) Q1 2020 Earnings Call Transcript
"FEB 18, 2020",Agilent Technologies Q1 adjusted earnings Inline With Estimates
"FEB 18, 2021",Agilent Launches Immunoassay Kit To Detect SARS-CoV-2 Antibodies
"FEB 18, 2022",What Makes Alcoa (AA) a Strong Momentum Stock: Buy Now?
"FEB 18, 2022",Agilent (A) to Report Q1 Earnings: What's in the Cards?
"FEB 18, 2022",Alcoa (AA) is an Incredible Growth Stock: 3 Reasons Why
"FEB 19, 2014","Westlake Hikes Dividend, Splits Stock - Analyst Blog"
"FEB 19, 2015","Company News for February 19, 2015 - Corporate Summary"
"FEB 19, 2016",5 Material and Mining Stocks Coming Back to Life
"FEB 19, 2016","After Hours Most Active for Feb 19, 2016 : CSX, HTZ, CXO, FEYE, PCL, IBN, BYD, AAPL, AA, KLAC, ZNGA, NVDA"
"FEB 19, 2019","Wal-Mart, CVS, Agilent, Hewlett-Packard and Kraft-Heinz are part of Zacks Earnings Preview"
"FEB 19, 2021",COLUMN-Time to forget tariffs and reset U.S. aluminium policy: Andy Home
"FEB 2, 2016","Alcoa Inc. (AA) Ex-Dividend Date Scheduled for February 03, 2016"
"FEB 2, 2017",Here's How Arconic Performed After Its First Ever Earnings Report
"FEB 2, 2017",Agilent (A) Announces Expanded Use of Diagnostic Assay
"FEB 2, 2019",Validea Joseph Piotroski Strategy Daily Upgrade Report - 2/2/2019
"FEB 2, 2019",What To Expect When Your CFO Leaves You
"FEB 2, 2020",Validea's Top Five Technology Stocks Based On Peter Lynch - 2/2/2020
"FEB 2, 2023",AA March 24th Options Begin Trading
"FEB 2, 2023",AA March 24th Options Begin Trading
"FEB 2, 2023",AA March 24th Options Begin Trading
"FEB 2, 2023",AA March 24th Options Begin Trading
"FEB 2, 2023",AA March 24th Options Begin Trading
"FEB 20, 2013",Agilent Unit Receives FDA Approval - Analyst Blog
"FEB 20, 2016",4 Stocks With Better Dividends Than Alcoa Inc.
"FEB 20, 2018",Agilent Technologies (A) Q1 2018 Earnings Conference Call Transcript
"FEB 20, 2019","After-Hours Earnings Report for February 20, 2019 : ET, NTES, A, ES, O, SNPS, EXR, CPRT, GDDY, FTI, SUI, Y"
"FEB 20, 2019",Agilent Technologies (A) Q1 Earnings and Revenues Surpass Estimates
"FEB 20, 2019",Agilent Consistently Adds to Earnings-Driven Post Market Moves in Follow-On Regular Session
"FEB 20, 2019","Earnings Reaction History: Agilent Technologies Inc, 60.0% Follow-Through Indicator, 3.9% Sensitive"
"FEB 21, 2013",PolyOne Boosts Shareholder Return - Analyst Blog
"FEB 21, 2017",This ETF Holds Stocks Insiders Want to Own
"FEB 21, 2017",Explosive Returns with the Filtered Zacks Rank 5 Strategy
"FEB 21, 2019",Agilent (A) Surpasses Earnings and Revenue Estimates in Q1
"FEB 21, 2019","Health Care Sector Update for 02/21/2019: JNJ, A, TFX, PFE, MRK, AMGN, ABT"
"FEB 21, 2019",AA April 5th Options Begin Trading
"FEB 21, 2021",COLUMN-Time to forget tariffs and reset U.S. aluminium policy: Andy Home
"FEB 21, 2023",Validea Guru Fundamental Report for AA - 2/21/2023
"FEB 21, 2023",Validea Guru Fundamental Report for AA - 2/21/2023
"FEB 21, 2023",Validea Guru Fundamental Report for AA - 2/21/2023
"FEB 21, 2023",Validea Guru Fundamental Report for AA - 2/21/2023
"FEB 21, 2023",Validea Guru Fundamental Report for AA - 2/21/2023
"FEB 22, 2016","Why Century Aluminum Co, Alcoa Inc, and Freeport-McMoRan Inc All Popped Today"
"FEB 22, 2016","Why Alcoa, Marathon Oil, and Teck Resources Jumped Today"
"FEB 22, 2017",Top Ranked Momentum Stocks to Buy for February 22nd
"FEB 22, 2019",Are You Looking for a Top Momentum Pick? Why Agilent Technologies (A) is a Great Choice
"FEB 22, 2019",Agilent (A) Upgraded to Buy: Here's Why
"FEB 22, 2022",Agilent Technologies (A) Q1 2022 Earnings Call Transcript
"FEB 22, 2022",Agilent Technologies Q1 sales increase
"FEB 22, 2022",Agilent Technologies (A) Q1 Earnings and Revenues Beat Estimates
"FEB 22, 2022",Agilent Technologies Raises FY22 Outlook
"FEB 22, 2022",Agilent Technologies Q1 22 Earnings Conference Call At 4:30 PM ET
"FEB 22, 2023",New Strong Sell Stocks for February 22nd
"FEB 22, 2023",New Strong Sell Stocks for February 22nd
"FEB 22, 2023",New Strong Sell Stocks for February 22nd
"FEB 22, 2023",New Strong Sell Stocks for February 22nd
"FEB 22, 2023",New Strong Sell Stocks for February 22nd
"FEB 23, 2015",Agilent-ONO Companion Diagnostics Aim - Analyst Blog
"FEB 23, 2016",62 Stock Upgrades (and Downgrades) for the Week
"FEB 23, 2017","David Einhorn Says Trump Bringing 'High Degree' of Uncertainty, Inflation"
"FEB 23, 2017","XME, AA, MUX, HL: ETF Inflow Alert"
"FEB 23, 2018","Noteworthy Friday Option Activity: A, LOW, AGN"
"FEB 23, 2022",Analyst Favorites: Alcoa Corporation Ranks As a Top Metals Pick
"FEB 23, 2022","XME, BTU, AA, ARCH: ETF Inflow Alert"
"FEB 23, 2022",Are These Industrial Products Stocks Undervalued Right Now?
"FEB 23, 2022","Agilent (A) Q1 Earnings & Revenues Beat Estimates, Rise Y/Y"
"FEB 24, 2017",Will Alcoa Corp. Pay a Dividend in 2017?
"FEB 24, 2019",Validea's Top Five Basic Materials Stocks Based On Joseph Piotroski - 2/24/2019
"FEB 24, 2022","Down 5.6% in 4 Weeks, Here's Why Agilent (A) Looks Ripe for a Turnaround"
"FEB 24, 2022",lululemon athletica Larger Than S&P 500 Component Agilent Technologies
"FEB 24, 2022",Best Momentum Stocks to Buy for February 24th
"FEB 24, 2022","Daily Dividend Report: TMO,TXT,BEN,AA,DE"
"FEB 24, 2022","Notable Thursday Option Activity: PYPL, AA, SAVA"
"FEB 24, 2022",New Strong Buy Stocks for February 24th
"FEB 24, 2023","Noteworthy Friday Option Activity: GOOG, LITE, AA"
"FEB 24, 2023",U.S. to impose 200% tariff on aluminum from Russia -White House
"FEB 24, 2023",U.S. to impose 200% tariff on aluminum from Russia -White House
"FEB 24, 2023","Noteworthy Friday Option Activity: GOOG, LITE, AA"
"FEB 24, 2023","Noteworthy Friday Option Activity: GOOG, LITE, AA"
"FEB 24, 2023",U.S. to impose 200% tariff on aluminum from Russia -White House
"FEB 24, 2023","Noteworthy Friday Option Activity: GOOG, LITE, AA"
"FEB 24, 2023",U.S. to impose 200% tariff on aluminum from Russia -White House
"FEB 24, 2023",U.S. to impose 200% tariff on aluminum from Russia -White House
"FEB 24, 2023","Noteworthy Friday Option Activity: GOOG, LITE, AA"
"FEB 25, 2013","Allied Motion Technologies, Inc. (AMOT) Ex-Dividend Date Scheduled for February 27, 2013"
"FEB 25, 2015","Middle East Shares Mixed, Helped by Comments from Fed's Yellen and Higher Oil Prices"
"FEB 25, 2016","Stock Market News for February 25, 2016"
"FEB 25, 2016",Analyst Favorites: Alcoa Ranks As a Top Metals Pick
"FEB 25, 2019","The Zacks Analyst Blog Highlights: McDonald's, CVS Health, Celgene, Coca-Cola and Agilent"
"FEB 25, 2019",Top Ranked Momentum Stocks to Buy for February 25th
"FEB 26, 2014","Vishay Intertechnology, Inc. (VSH) Ex-Dividend Date Scheduled for February 27, 2014"
"FEB 26, 2014","Allied Motion Technologies, Inc. (AMOT) Ex-Dividend Date Scheduled for February 27, 2014"
"FEB 26, 2018",Berkshire Hathaway Looking to Make 'Huge' Acquisition with $116 Bln War Chest
"FEB 26, 2019",Top Ranked Momentum Stocks to Buy for February 26th
"FEB 26, 2020",First Week of AA October 16th Options Trading
"FEB 26, 2020",Analysts Forecast 14% Upside For SPXE
"FEB 26, 2020",AA Stock Crowded With Sellers
"FEB 27, 2013","Cohu, Inc. (COHU) Ex-Dividend Date Scheduled for March 01, 2013"
"FEB 27, 2014",Thursday's ETF with Unusual Volume: IXJ
"FEB 27, 2014","Cohu, Inc. (COHU) Ex-Dividend Date Scheduled for February 28, 2014"
"FEB 27, 2020",Interesting AA Put And Call Options For April 9th
"FEB 28, 2018",AA Crosses Critical Technical Indicator
"FEB 28, 2019",Booking Holdings (BKNG) Q4 Earnings & Revenues Beat Estimates
"FEB 28, 2019",Square (SQ) Surpasses Q4 Earnings and Revenue Estimates
"FEB 28, 2021","Don't Ignore The Fact That This Insider Just Sold Some Shares In Agilent Technologies, Inc. (NYSE:A)"
"FEB 28, 2023",Alcoa (AA) Gains As Market Dips: What You Should Know
"FEB 28, 2023",Alcoa (AA) Gains As Market Dips: What You Should Know
"FEB 28, 2023",Alcoa (AA) Gains As Market Dips: What You Should Know
"FEB 28, 2023",Alcoa (AA) Gains As Market Dips: What You Should Know
"FEB 28, 2023",Alcoa (AA) Gains As Market Dips: What You Should Know
"FEB 3, 2015","Alcoa Inc. (AA) Ex-Dividend Date Scheduled for February 04, 2015"
"FEB 3, 2018",Validea Kenneth Fisher Strategy Daily Upgrade Report - 2/3/2018
"FEB 3, 2022",Ametek (AME) Surpasses Q4 Earnings and Revenue Estimates
"FEB 3, 2022",New to Investing? This 1 Computer and Technology Stock Could Be the Perfect Starting Point
"FEB 3, 2023",Alcoa says workers back 2024 restart of its aluminum smelter in Spain
"FEB 3, 2023",Alcoa says workers back 2024 restart of its aluminum smelter in Spain
"FEB 3, 2023",Alcoa says workers back 2024 restart of its aluminum smelter in Spain
"FEB 3, 2023",Alcoa says workers back 2024 restart of its aluminum smelter in Spain
"FEB 3, 2023",Alcoa says workers back 2024 restart of its aluminum smelter in Spain
"FEB 4, 2016",March 24th Options Now Available For Alcoa (AA)
"FEB 4, 2016","S&P 500 Movers: RL, FCX"
"FEB 4, 2018",Validea's Top Five Technology Stocks Based On Martin Zweig - 2/4/2018
"FEB 4, 2022",Alcoa Reaches Analyst Target Price
"FEB 5, 2013",Edward Owens' 3 Biggest Stock Increases
"FEB 5, 2015","After Hours Most Active for Feb 5, 2015 : BAC, TWTR, P, QQQ, FTR, DOW, GPRO, SDRL, AA, ATVI, ODP, EXPE"
"FEB 5, 2016",Is The Airbus A380 Coming Of Age?
"FEB 5, 2016",Director buys Alcoa shares
"FEB 5, 2016",iShares Morningstar Mid-Cap Value ETF -- Insider Buying Index Registering 11.3%
"FEB 5, 2016","Stock Market News for February 05, 2016"
"FEB 5, 2018",3 Top Aluminum Stocks to Consider Buying Now
"FEB 6, 2013","What ""Global"" Fear Matters to Stocks? - Real Time Insight"
"FEB 6, 2013","Park Electrochemical Corporation (PKE) Ex-Dividend Date Scheduled for February 08, 2013"
"FEB 6, 2013",Kraton's Cariflex at MEDTEC Europe - Analyst Blog
"FEB 6, 2014","Park Electrochemical Corporation (PKE) Ex-Dividend Date Scheduled for February 07, 2014"
"FEB 6, 2015","Stock Market News for February 06, 2015 - Market News"
"FEB 6, 2016",Why Alcoa Inc.'s Shares Fell 26% in January
"FEB 6, 2017",Agilent (A) Announces Expanded Use of Diagnostic Assay (revised)
"FEB 6, 2018",Warren Buffett's Wells Fargo Problem
"FEB 6, 2018",Will Lower Ad Revenues Hurt Twitter's (TWTR) Q4 Earnings?
"FEB 6, 2018",What's in the Cards for Broadridge (BR) in Q2 Earnings?
"FEB 6, 2018",Will Growth in Diner Base Aid GrubHub's (GRUB) Q4 Earnings?
"FEB 6, 2020",3 Beaten-Down Stocks to Sell Now
"FEB 7, 2014",Positive Surprises & Negative Guidance - Earnings Preview
"FEB 7, 2018",Analysts Forecast 11% Gains Ahead For FTCS
"FEB 7, 2019",Will the Departure of Arconic's CEO Derail Its Turnaround Plan?
"FEB 7, 2020","Twist Biosciences and Agilent Settle Dispute, Avoid Costly Trial"
"FEB 7, 2022","A Look At The Fair Value Of Agilent Technologies, Inc. (NYSE:A)"
"FEB 8, 2016",NetApp (NTAP) to Report Q3 Earnings: What's in Store?
"FEB 8, 2016",Paycom Software (PAYC) Q4 Earnings: What's in the Cards?
"FEB 8, 2016",What's in Store for CDW Corp. this Earnings Season?
"FEB 8, 2016",Computer Sciences (CSC) Q3 Earnings: What to Expect?
"FEB 8, 2017",Top Ranked Growth Stocks to Buy for February 8th
"FEB 8, 2017",Tempur Sealy: Is There Any Money Under The Mattress
"FEB 8, 2018",Using Options to Find Investor Sentiment Extremes
"FEB 8, 2019",Validea David Dreman Strategy Daily Upgrade Report - 2/8/2019
"FEB 8, 2019",Net 1 UEPS Technologies Inc (UEPS) Q2 2019 Earnings Conference Call Transcript
"FEB 8, 2022",Why Alcoa and Century Aluminum Popped on Tuesday
"FEB 9, 2015",AA Crosses Below Key Moving Average Level
"FEB 9, 2015",A Choppy Start to a New Year - Analyst Blog
"FEB 9, 2016",What's in the Cards for FireEye (FEYE) in Q4 Earnings?
"FEB 9, 2016",What's in Store for Zillow Group (ZG) this Earnings Season?
"FEB 9, 2017",3 Key Metrics for Alcoa Corp Investors to Focus On
"FEB 9, 2018","Notable Friday Option Activity: A, CMG, AAPL"
"FEB 9, 2019",Arconic Set to Split as New CEO Makes His Mark
"JAN 10, 2014",Is A. Schulman (SHLM) Stock a Great Combo of Value and Growth? - Tale of the Tape
"JAN 10, 2016",3 Stocks That Could Make Huge Moves This Week
"JAN 10, 2016",What to Watch in the Stock Market This Week
"JAN 10, 2018",Berkshire Hathaway to Increase Number of Directors to 14 From 12
"JAN 10, 2018",Agilent (A) Expands Portfolio With Luxcel Biosciences Buyout
"JAN 10, 2023","Alcoa Names William Oplinger COO, Molly Beerman CFO, Effective February 1"
"JAN 10, 2023",Bullish Two Hundred Day Moving Average Cross - AA
"JAN 10, 2023",Bullish Two Hundred Day Moving Average Cross - AA
"JAN 10, 2023","Alcoa Names William Oplinger COO, Molly Beerman CFO, Effective February 1"
"JAN 10, 2023","Alcoa Names William Oplinger COO, Molly Beerman CFO, Effective February 1"
"JAN 10, 2023",Bullish Two Hundred Day Moving Average Cross - AA
"JAN 10, 2023","Alcoa Names William Oplinger COO, Molly Beerman CFO, Effective February 1"
"JAN 10, 2023",Bullish Two Hundred Day Moving Average Cross - AA
"JAN 10, 2023",Bullish Two Hundred Day Moving Average Cross - AA
"JAN 10, 2023","Alcoa Names William Oplinger COO, Molly Beerman CFO, Effective February 1"
"JAN 10, 2023","Alcoa Names William Oplinger COO, Molly Beerman CFO, Effective February 1"
"JAN 10, 2023",Bullish Two Hundred Day Moving Average Cross - AA
"JAN 10, 2023",Bullish Two Hundred Day Moving Average Cross - AA
"JAN 10, 2023","Alcoa Names William Oplinger COO, Molly Beerman CFO, Effective February 1"
"JAN 11, 2012",A. Schulman Enters Oversold Territory - Tale of the Tape
"JAN 11, 2016",China Shadow Looms as Q4 Earnings Begin
"JAN 11, 2016","Agilent Appoints Tang as SVP, General Counsel and Secretary"
"JAN 11, 2016",Alcoa Consistently Adds to Earnings-Driven After-Hours Declines in Next-Day Regular Session Trade
"JAN 11, 2016",Interesting January 2017 Stock Options for AA
"JAN 11, 2016",Materials ETFs Fall; Alcoa Slides On Revenue Miss
"JAN 11, 2016","Earnings Reaction History: Alcoa Inc., 55.6% Follow-Through Indicator, 3.1% Sensitive"
"JAN 11, 2016","Company News for January 11, 2016"
"JAN 11, 2016","After Hours Most Active for Jan 11, 2016 : F, YHOO, QQQ, LYG, BHI, WMB, HPE, AMAT, AAPL, AA, LSCC, XIV"
"JAN 11, 2016","Alcoa Beats on Q4 Earnings, Details Company Split"
"JAN 11, 2017","Noteworthy Wednesday Option Activity: IMMR, WDAY, A"
"JAN 11, 2019",Close Update: Nasdaq Leads Market Higher for Week as Stocks End Friday Near Unchanged
"JAN 11, 2022",GRAPHIC-Power fuels aluminium's price surge to record in Europe
"JAN 11, 2023",Earnings Preview: Alcoa (AA) Q4 Earnings Expected to Decline
"JAN 11, 2023",Alcoa reverts to gas for fuelling alumina refineries in Western Australia
"JAN 11, 2023",Alcoa reverts to gas for fuelling alumina refineries in Western Australia
"JAN 11, 2023",Alcoa reverts to gas for fuelling alumina refineries in Western Australia
"JAN 11, 2023",Alcoa reverts to gas for fuelling alumina refineries in Western Australia
"JAN 11, 2023",Earnings Preview: Alcoa (AA) Q4 Earnings Expected to Decline
"JAN 11, 2023",Chevron restarts production at Wheatstone gas plant
"JAN 11, 2023",Earnings Preview: Alcoa (AA) Q4 Earnings Expected to Decline
"JAN 11, 2023",Earnings Preview: Alcoa (AA) Q4 Earnings Expected to Decline
"JAN 11, 2023",Chevron restarts production at Wheatstone gas plant
"JAN 11, 2023",Chevron restarts production at Wheatstone gas plant
"JAN 11, 2023",Earnings Preview: Alcoa (AA) Q4 Earnings Expected to Decline
"JAN 11, 2023",Earnings Preview: Alcoa (AA) Q4 Earnings Expected to Decline
"JAN 11, 2023",Chevron restarts production at Wheatstone gas plant
"JAN 11, 2023",Chevron restarts production at Wheatstone gas plant
"JAN 11, 2023",Alcoa reverts to gas for fuelling alumina refineries in Western Australia
"JAN 11, 2023",Earnings Preview: Alcoa (AA) Q4 Earnings Expected to Decline
"JAN 11, 2023",Chevron restarts production at Wheatstone gas plant
"JAN 11, 2023",Alcoa reverts to gas for fuelling alumina refineries in Western Australia
"JAN 11, 2023",Earnings Preview: Alcoa (AA) Q4 Earnings Expected to Decline
"JAN 11, 2023",Chevron restarts production at Wheatstone gas plant
"JAN 11, 2023",Alcoa reverts to gas for fuelling alumina refineries in Western Australia
"JAN 11, 2023",Alcoa reverts to gas for fuelling alumina refineries in Western Australia
"JAN 12, 2012","Zacks Releases Four Powerful ''Buy'' Stocks: InnerWorkings, A. Schulman, Men's Warehouse and Lincoln Electric Holdings - Press Releases"
"JAN 12, 2012","A. Schulman, Inc. - Growth & Income"
"JAN 12, 2015",Alcoa Sets Bullish Historical Tone for Shorts Trading Shares off Earnings-Driven After-Hours Moves
"JAN 12, 2015","Earnings Reaction History: Alcoa Inc., 55.6% Follow-Through Indicator, 3.3% Sensitive"
"JAN 12, 2015","After-Hours Earnings Report for January 12, 2015 : AA, SNX, LMNR"
"JAN 12, 2015",Alcoa Earnings Start 2015 on the Right Foot
"JAN 12, 2015","After Hours Most Active for Jan 12, 2015 : BAC, BRCD, GE, INTC, AA, HAL, GSK, EMC, MSFT, AMAT, QQQ, YHOO"
"JAN 12, 2015",Can Q4 Earnings Season Stop the Oil Slide? - Ahead of Wall Street
"JAN 12, 2015",How to hedge your earnings play
"JAN 12, 2015",Alcoa Earnings Impressive Again - Analyst Blog
"JAN 12, 2015",4 Earnings Plays for Q4: Add These to Your Portfolio - Analyst Blog
"JAN 12, 2015","What to Expect This Week: Markets Will Be Driven By Earnings, Dollar Strength"
"JAN 12, 2016",Midday Update: Stocks Drift Off Highs As Oil Targets $29 Per Barrel
"JAN 12, 2016","Awaiting New Catalysts, Q4 Earnings on the Way"
"JAN 12, 2016","Alcoa's Q4 Earnings Beat, Charges & Lower Prices Hit Net"
"JAN 12, 2016","Pre-Market Most Active for Jan 12, 2016 : XIV, TVIX, AAPL, AA, QQQ, FB, LULU, NOK, SUNE, RIO, SAP, BAC"
"JAN 12, 2016","US Stock Futures Follow Europe Higher to Buck Weaker Asia, Oil"
"JAN 12, 2016",Dow Jones Industrial Average Rises 117 Points as Tech Rebounds
"JAN 12, 2016",Alcoa Posts Strong Q4 Results
"JAN 12, 2016",Preliminary Results Create a Stir for These 4 MedTech Stocks
"JAN 12, 2016",Alcoa Sinks and Burlington Stores Jumps as Stocks Rebound
"JAN 12, 2016","Why Alcoa, Penn National Gaming, and Eldorado Gold Slumped Today"
"JAN 12, 2016",Brutal Earnings Season? Hide Out in These 5 Blue Chip Stocks
"JAN 12, 2017",Better Buy: Alcoa Inc. vs. Barrick Gold
"JAN 12, 2022",Alcoa (AA) Reports Next Week: Wall Street Expects Earnings Growth
"JAN 12, 2022",Alcoa Corp Shares Close in on 52-Week High - Market Mover
"JAN 12, 2023",Earnings Preview for the Week of January 16th
"JAN 12, 2023",Earnings Preview for the Week of January 16th
"JAN 12, 2023",Will Alcoa (AA) Disappoint in Q4 Earnings on Lower Shipments?
"JAN 12, 2023","Notable ETF Inflow Detected - XME, CLF, AA, UEC"
"JAN 12, 2023",Will Alcoa (AA) Disappoint in Q4 Earnings on Lower Shipments?
"JAN 12, 2023",Earnings Preview for the Week of January 16th
"JAN 12, 2023","Notable ETF Inflow Detected - XME, CLF, AA, UEC"
"JAN 12, 2023","Notable ETF Inflow Detected - XME, CLF, AA, UEC"
"JAN 12, 2023","Notable ETF Inflow Detected - XME, CLF, AA, UEC"
"JAN 12, 2023",Will Alcoa (AA) Disappoint in Q4 Earnings on Lower Shipments?
"JAN 12, 2023",Fed Fodder Highlights Holiday-Shortened Week
"JAN 12, 2023",Fed Fodder Highlights Holiday-Shortened Week
"JAN 12, 2023",Will Alcoa (AA) Disappoint in Q4 Earnings on Lower Shipments?
"JAN 12, 2023",Fed Fodder Highlights Holiday-Shortened Week
"JAN 12, 2023",Earnings Preview for the Week of January 16th
"JAN 12, 2023","Notable ETF Inflow Detected - XME, CLF, AA, UEC"
"JAN 12, 2023",Earnings Preview for the Week of January 16th
"JAN 12, 2023",Earnings Preview for the Week of January 16th
"JAN 12, 2023",Earnings Preview for the Week of January 16th
"JAN 12, 2023",Will Alcoa (AA) Disappoint in Q4 Earnings on Lower Shipments?
"JAN 12, 2023","Notable ETF Inflow Detected - XME, CLF, AA, UEC"
"JAN 12, 2023",Fed Fodder Highlights Holiday-Shortened Week
"JAN 12, 2023",Fed Fodder Highlights Holiday-Shortened Week
"JAN 12, 2023",Earnings Preview for the Week of January 16th
"JAN 12, 2023",Will Alcoa (AA) Disappoint in Q4 Earnings on Lower Shipments?
"JAN 12, 2023","Notable ETF Inflow Detected - XME, CLF, AA, UEC"
"JAN 12, 2023",Fed Fodder Highlights Holiday-Shortened Week
"JAN 12, 2023",Fed Fodder Highlights Holiday-Shortened Week
"JAN 12, 2023",Fed Fodder Highlights Holiday-Shortened Week
"JAN 12, 2023","Notable ETF Inflow Detected - XME, CLF, AA, UEC"
"JAN 12, 2023",Will Alcoa (AA) Disappoint in Q4 Earnings on Lower Shipments?
"JAN 12, 2023",Will Alcoa (AA) Disappoint in Q4 Earnings on Lower Shipments?
"JAN 13, 2014",Agilent Unit & Merck Collaborate - Analyst Blog
"JAN 13, 2014",Westlake Reaches 52-Week High - Analyst Blog
"JAN 13, 2015",Mid-Day Market Update: Pharmacyclics Surges On Strong Preliminary 2014 Results; Fresh Market Shares Slip
"JAN 13, 2015",Earnings Season Begins: Will Strong Results Keep Boosting the Stock Market?
"JAN 13, 2015","Midday Update: Better-Than-Expected Alcoa Results Spurring Rally for Stocks, Easing Worries About Sluggish Q4"
"JAN 13, 2015","Dow, Other Market Gauges Give Back Early Gains as Morning Rally Spurs Fresh Selling Late"
"JAN 13, 2015",Robust Alcoa Earnings Put These Materials ETFs in Focus - ETF News And Commentary
"JAN 13, 2015",Mid-Morning Market Update: Markets Open Higher; Alcoa Profit Beats Expectations
"JAN 13, 2015",Q4 Earnings Inform the Market - Ahead of Wall Street
"JAN 13, 2015",US Futures Gain as Upbeat Start to Earnings Season Overshadows Oil Prices
"JAN 13, 2015","Alcoa's (AA) Q4 Earnings Top on Aerospace, Auto Strength - Analyst Blog"
"JAN 13, 2015",Affymetrix's Preliminary Q4 Revenues Outshine Estimates - Analyst Blog
"JAN 13, 2016",Q4 Earnings: 5 Things to Keep in Mind Before Picking Stocks
"JAN 13, 2017",Better Buy: Alcoa Inc. vs. Hecla Mining
"JAN 13, 2017",Arconic Inc's Stock Plunged 18% in 2016: Here's Why It's Worth Buying Now
"JAN 13, 2020",What to Watch As Earnings Season Gets Underway
"JAN 14, 2014","Methode Electronics, Inc. (MEI) Ex-Dividend Date Scheduled for January 15, 2014"
"JAN 14, 2015","Stock Market News for January 14, 2015 - Market News"
"JAN 14, 2016",What Alcoa's Outlook Means for Industrial Stocks
"JAN 14, 2019",5 Fallen-Angel Stocks That Have Been Oversold
"JAN 14, 2022",Alcoa (AA) Outpaces Stock Market Gains: What You Should Know
"JAN 14, 2022",How Alcoa (AA) Stock Stands Out in a Strong Industry
"JAN 15, 2013","Agilent's Dako, Eli in Agreement - Analyst Blog"
"JAN 15, 2014",Westlake Upgraded to Strong Buy - Analyst Blog
"JAN 15, 2015",Agilent Arm/Cell Signaling Tie for Companion Diagnostics - Analyst Blog
"JAN 15, 2018",3 Things to Watch in the Stock Market This Week
"JAN 15, 2018",Will 2018 Be Alcoa Inc.'s Best Year Yet?
"JAN 15, 2019","Noteworthy Tuesday Option Activity: DIS, AA, SQ"
"JAN 15, 2020",Alcoa Corporation (AA) Q4 2019 Earnings Call Transcript
"JAN 15, 2020",Alcoa Q4 Results Miss View
